link, desig, details, org, loc, exp, keyskills, descl, salary, date, expLow, expHigh, salLow, salHigh 
https://www.naukri.com/job-listings-Senior-Associate-IT-Quality-Assurance-SAP-Hybris-Ecommerce-Testing-Klaus-IT-Solutions-Pvt-Ltd-Chennai-4-to-7-years-220318900534?src=jobsearchDesk&sid=15217229125272&xp=1&px=1,Senior Associate - IT Quality Assurance - SAP Hybris Ecommerce Testing,Senior Associate - IT Quality Assurance - SAP Hybris Ecommerce Testing,Klaus IT Solutions Pvt Ltd,Chennai,4-7 yrs,Automation Testing- Selenium- SOAP UI- Exploratory Testing- Test Cases...,Required Skill Set  - SAP Hybris eCommerce Testing - At least 1 or 2 Projects  - Agile ...,Not disclosed,2018-03-22,4,7,0,0
https://www.naukri.com/job-listings-IT-Technology-Consultant-Process-Analyst-SAP-India-Pvt-Ltd-Gurgaon-5-to-10-years-220318900367?src=jobsearchDesk&sid=15217229125272&xp=2&px=1,IT Technology Consultant- Process Analyst,IT Technology Consultant- Process Analyst,SAP India Pvt.Ltd,Gurgaon,5-10 yrs,SAP- Project management- ERP- Automation- Workflow- Service...,Requisition ID: 180074  Work Area: Information Technology  Expected Travel: 0 -  10%  Career ...,Not disclosed,2018-03-22,5,10,0,0
https://www.naukri.com/job-listings-IT-Technology-Consultant-Technical-Writer-SAP-India-Pvt-Ltd-Bengaluru-5-to-10-years-220318900364?src=jobsearchDesk&sid=15217229125272&xp=3&px=1,IT Technology Consultant- Technical Writer,IT Technology Consultant- Technical Writer,SAP India Pvt.Ltd,Bengaluru,5-10 yrs,SAP- ERP- Agile- Service- Technical writing- Information technology...,Requisition ID: 180069  Work Area: Information Technology  Expected Travel: 0 -  10%  Career ...,Not disclosed,2018-03-22,5,10,0,0
https://www.naukri.com/job-listings-Unix-IT-Support-Engineer-Baxter-India-Pvt-Ltd-Bengaluru-Whitefield-5-to-8-years-220318006158?src=jobsearchDesk&sid=15217229125272&xp=4&px=1,Unix IT Support Engineer,Unix IT Support Engineer,Baxter India Pvt. Ltd.,Bengaluru(Whitefield),5-8 yrs,linux server- solaris- zfs- networking- unix- technical support- it support...,Baxter international is looking for a UNIX IT support individual.   -	Strong writing and oral ...,Not disclosed,2018-03-22,5,8,0,0
https://www.naukri.com/job-listings-IT-Faculty-Assistant-Professor-Associate-Professor-ICFAI-University-Jharkhand-Ranchi-5-to-10-years-220318004993?src=jobsearchDesk&sid=15217229125272&xp=5&px=1,IT Faculty - Assistant Professor / Associate Professor,IT Faculty - Assistant Professor / Associate Professor,ICFAI University Jharkhand,Ranchi,5-10 yrs,Computer Teaching- Artificial Intelligence- Data Mining- Big Data Analytics..., Job Description:  Teaching - Evaluation and Mentoring the   students  * Teaching ...,Not disclosed,2018-03-22,5,10,0,0
https://www.naukri.com/job-listings-Technical-Recruiter-US-IT-Staffing-night-Shift-Noida-FCS-Software-Solutions-Limited-Noida-Sector-57-Noida-1-to-3-years-060318005736?src=jobsearchDesk&sid=15217229125272&xp=6&px=1,Technical Recruiter US IT Staffing (night Shift)- Noida,Technical Recruiter US IT Staffing (night Shift)- Noida,FCS Software Solutions Limited,Noida(Sector-57 Noida),1-3 yrs,IT Recruitment- Technical Recruitment- US Staffing- Screening...,Dear Candidate-    Greetings-     FCS Software Solutions ...,250000 - 600000 P.A. incentives(3 types ) + meals +...,2018-03-22,1,3,250000,600000
https://www.naukri.com/job-listings-Business-Development-Manager-IT-People-Hire-Consulting-Bengaluru-2-to-7-years-220318002837?src=jobsearchDesk&sid=15217229125272&xp=7&px=1,Business Development Manager - IT,Business Development Manager - IT,People Hire Consulting,Bengaluru,2-7 yrs,Business Development Management- Software Sales- Bdm- New Business- B2B..., Job Description  :  The BDM will work directly with the CEO- founder and other senior ...,Not disclosed,2018-03-22,2,7,0,0
https://www.naukri.com/job-listings-Windows-IT-Support-Engineer-Baxter-India-Pvt-Ltd-Bengaluru-Whitefield-5-to-8-years-220318006014?src=jobsearchDesk&sid=15217229125272&xp=8&px=1,Windows IT Support Engineer,Windows IT Support Engineer,Baxter India Pvt. Ltd.,Bengaluru(Whitefield),5-8 yrs,vmware infrastructure- windows server- citrix server- esx server- Nutanix...,Baxter international is looking for a Windows IT support individual.   -	Strong writing and oral ...,Not disclosed,2018-03-22,5,8,0,0
https://www.naukri.com/job-listings-Content-Writer-IT-Software-NSEZ-Noida-ProProfs-com-Delhi-NCR-Noida-1-to-3-years-010817000909?src=jobsearchDesk&sid=15217229125272&xp=9&px=1,Content Writer  - IT / Software -  NSEZ  Noida,Content Writer  - IT / Software -  NSEZ  Noida,ProProfs.com,Delhi NCR- Noida,1-3 yrs,content writer-  content writing-  articles-  blogs-  proof reading...,Job Description:  We are looking for a strong web content writer to work on ProProfs.com and ...,Not disclosed,2018-03-22,1,3,0,0
https://www.naukri.com/job-listings-Backend-Process-Mumbai-Fresher-Graduates-No-Be-Btech-OR-BSC-IT-Trigent-Software-Limited-Mumbai-0-to-0-years-220318001244?src=jobsearchDesk&sid=15217229125272&xp=10&px=1,Backend Process - Mumbai - Fresher Graduates (No Be Btech OR BSC IT),Backend Process - Mumbai - Fresher Graduates (No Be Btech OR BSC IT),Trigent Software Limited,Mumbai,0-0 yrs,Non Voice- Backend- BPO,Greetings for Trigent Software We have openings with MNC for Backend Process.  Experience: ...,100000 - 200000 P.A.,2018-03-22,0,0,100000,200000
https://www.naukri.com/job-listings-Head-POS-System-Sales-IT-Firm-Vrinda-Global-Private-Limited-Noida-10-to-15-years-220318006187?src=jobsearchDesk&sid=15217229125272&xp=11&px=1,Head - POS System Sales - IT Firm,Head - POS System Sales - IT Firm,Vrinda Global Private Limited,Noida,10-15 yrs,business development- sales- client servicing- business solutions...,Hiring for a leading provider of web based solutions diversified group into four different divisions ...,Not disclosed,2018-03-22,10,15,0,0
https://www.naukri.com/job-listings-Walk-In-Drive-with-CMS-IT-Services-Mahape-on-24th-March-CMS-IT-SERVICES-PRIVATE-LIMITED-Mumbai-Mumbai-Suburbs-Navi-Mumbai-0-to-2-years-220318005929?src=jobsearchDesk&sid=15217229125272&xp=12&px=1,Walk In Drive with CMS IT Services @ Mahape on 24th March,Walk In Drive with CMS IT Services @ Mahape on 24th March,CMS IT SERVICES PRIVATE LIMITED,Mumbai- Mumbai Suburbs- Navi Mumbai,0-2 yrs,Networking- Technical Support- Product Support- Desktop Support..., As one of Indias top IT services firms- CMS IT services has support infrastructure spread across 30 ...,50000 - 200000 P.A.,2018-03-22,0,2,50000,200000
https://www.naukri.com/job-listings-IT-Sales-Professional-Pioneer-e-solutions-P-Ltd-Delhi-2-to-4-years-220318900424?src=jobsearchDesk&sid=15217229125272&xp=13&px=1,IT Sales Professional,IT Sales Professional,Pioneer-e-solutions (P) Ltd.,Delhi,2-4 yrs,IT Sales- New Business- IT Staffing- Spoken English- IT Skills- Sales,IT Sales: Minimum experienced required:- 2 to 4 yrs   Current Location:- Delhi ...,Not disclosed,2018-03-22,2,4,0,0
https://www.naukri.com/job-listings-IT-Recruiter-Pioneer-e-solutions-P-Ltd-Delhi-0-to-5-years-220318900422?src=jobsearchDesk&sid=15217229125272&xp=14&px=1,IT Recruiter,IT Recruiter,Pioneer-e-solutions (P) Ltd.,Delhi,0-5 yrs,IT Recruitment- Screening- Sourcing Profiles- Interviewing- Linkedin...,IT Recruiter: Minimum experienced required:- 0.6 Month to 3 Years   Current Location:- Delhi ...,Not disclosed,2018-03-22,0,5,0,0
https://www.naukri.com/job-listings-Associate-Consultant-m-e-it-NACO-Contractual-role-NISG-National-Institute-For-Smart-Governent-Delhi-3-to-8-years-220318005585?src=jobsearchDesk&sid=15217229125272&xp=15&px=1,Associate Consultant (m&e;/it) NACO Contractual role,Associate Consultant (m&e;/it) NACO Contractual role,NISG ( National Institute For Smart Governent),Delhi,3-8 yrs,M&E;- IT- Health Program- HIV / AIDS- Managing- Implementation- IT Projects,Nature of Experience:  Minimum 3 years experience in managing / implementing IT projects & ...,Not disclosed,2018-03-22,3,8,0,0
https://www.naukri.com/job-listings-Immediate-Hiring-for-US-IT-in-Hyderabad-Location-Spectraforce-Technologies-India-Pvt-Ltd-Hyderabad-1-to-6-years-220318004355?src=jobsearchDesk&sid=15217229125272&xp=16&px=1,Immediate Hiring for "US IT Recruiters" in Hyderabad Location,Immediate Hiring for "US IT Recruiters" in Hyderabad Location,Spectraforce Technologies (India) Pvt. Ltd.,Hyderabad,1-6 yrs,Recruitment- Process Training- Inbound- Outbound- Recognition- Benefits..., LOOKING FOR  Experienced US IT Recruiters/Sr. Recruiters in Hyderabad!  Job ...,Not disclosed,2018-03-22,1,6,0,0
https://www.naukri.com/job-listings-CES-IT-Sr-java-java-Lead-Scheduled-Walk-in-on-24-mar-18-Saturda-CES-Ltd-Hyderabad-Gachibowli-6-to-11-years-220318004002?src=jobsearchDesk&sid=15217229125272&xp=17&px=1,CES IT - Sr.java /java Lead - Scheduled Walk-in on 24-mar-18 Saturda,CES IT - Sr.java /java Lead - Scheduled Walk-in on 24-mar-18 Saturda,CES Ltd.,Hyderabad(Gachibowli),6-11 yrs,HTML- Javascript- CSS- Play Framework- Grunt- MySQL- JPA- Spring- Java...,CES IT - We are conducting a (Scheduled Face-Face/Scheduled Walk-in) Interview on 24th March 2018 ...,Not disclosed,2018-03-22,6,11,0,0
https://www.naukri.com/job-listings-Amiga-Informatics-Hiring-For-IT-Recruiter-non-IT-Recruiter-bench-Sales-Amiga-Informatics-Pvt-Ltd-Noida-1-to-4-years-220318003647?src=jobsearchDesk&sid=15217229125272&xp=18&px=1,Amiga Informatics Hiring For IT Recruiter/non IT Recruiter/bench Sales,Amiga Informatics Hiring For IT Recruiter/non IT Recruiter/bench Sales,Amiga Informatics Pvt. Ltd,Noida,1-4 yrs,Non IT Recruitment- US Staffing- Screening- Sourcing- Night Shift...,#Should have1 to 4 years in to US Staffing(IT/Non IT) #Applicant should possess good communication ...,225000 - 500000 P.A.,2018-03-22,1,4,225000,500000
https://www.naukri.com/job-listings-Amiga-Informatics-Hiring-for-IT-Recruiter-senior-IT-Recruiter-Amiga-Informatics-Pvt-Ltd-Noida-1-to-4-years-220318003347?src=jobsearchDesk&sid=15217229125272&xp=19&px=1,Amiga Informatics Hiring for IT Recruiter/senior IT Recruiter,Amiga Informatics Hiring for IT Recruiter/senior IT Recruiter,Amiga Informatics Pvt. Ltd,Noida,1-4 yrs,Technical Recruitment- IT Recruitment- Screening- Sourcing- Interviewing...,#Candidates should have 1 to 4 years of experience into Technical Recruitment. #Understanding the ...,175000 - 375000 P.A.,2018-03-22,1,4,175000,375000
https://www.naukri.com/job-listings-Manager-Engagement-IT-Startup-People-Hire-Consulting-Bengaluru-2-to-5-years-220318002831?src=jobsearchDesk&sid=15217229125272&xp=20&px=1,Manager - Engagement - IT Startup,Manager - Engagement - IT Startup,People Hire Consulting,Bengaluru,2-5 yrs,C++- Java- Python- Project Delivery- Meteor- Client Engagement..., Job Description    The EM will work directly with the founder and other senior leaders ...,Not disclosed,2018-03-22,2,5,0,0
https://www.naukri.com/job-listings-Manager-Product-Marketing-IT-People-Hire-Consulting-Gurgaon-2-to-7-years-220318002823?src=jobsearchDesk&sid=15217229125272&xp=21&px=1,Manager - Product Marketing - IT,Manager - Product Marketing - IT,People Hire Consulting,Gurgaon,2-7 yrs,Product Marketing- Sales Management- Product Management..., What You Will Be Doing -    - Identify market opportunities- articulate competitive ...,Not disclosed,2018-03-22,2,7,0,0
https://www.naukri.com/job-listings-Global-Talent-Acquisition-Head-India-US-IT-RGF-Select-India-Gurgaon-Gurugram-12-to-15-years-220318002306?src=jobsearchDesk&sid=15217229125272&xp=22&px=1,Global Talent Acquisition Head - India & US - IT,Global Talent Acquisition Head - India & US - IT,RGF Select India,Gurgaon- Gurugram,12-15 yrs,Talent Acquisition Head- HR- recruitment- talent acquisition...,Required Global Talent Acquisition Head (India & US) from IT Services Industry background ...,Not disclosed,2018-03-22,12,15,0,0
https://www.naukri.com/job-listings-Business-Analyst-Content-Specialist-with-Innovative-IT-Company-DOCTILY-Hyderabad-1-to-2-years-220318000742?src=jobsearchDesk&sid=15217229125272&xp=23&px=1,Business Analyst/ Content Specialist with Innovative IT Company,Business Analyst/ Content Specialist with Innovative IT Company,DOCTILY,Hyderabad,1-2 yrs,medical- business analysis- communication skills- Content Writing...,  Business Analyst/Content Specialist with 1+ years experience of developing science/business ...,100000 - 125000 P.A.,2018-03-22,1,2,100000,125000
https://www.naukri.com/job-listings-IT-Service-Delivery-Manager-Infrastructure-Work-FROM-Home-Option-Genex-Corporate-Services-Pvt-Ltd-Navi-Mumbai-Mumbai-Tardeo-0-to-2-years-220318000396?src=jobsearchDesk&sid=15217229125272&xp=24&px=1,IT Service Delivery Manager - Infrastructure - Work FROM Home Option,IT Service Delivery Manager - Infrastructure - Work FROM Home Option,Genex Corporate Services Pvt. Ltd,Navi Mumbai- Mumbai(Tardeo),0-2 yrs,Service Delivery Management- IT Service Delivery- Client Relationship- ITIL..., Building strong relationship with Clients and Employees.  Frequent visits to Client ...,250000 - 500000 P.A.,2018-03-22,0,2,250000,500000
https://www.naukri.com/job-listings-Senior-Consultant-IT-Consulting-Information-Security-Protiviti-Delhi-NCR-3-to-5-years-210318900555?src=jobsearchDesk&sid=15217229125272&xp=25&px=1,Senior Consultant - IT Consulting - Information Security,Senior Consultant - IT Consulting - Information Security,Protiviti,Delhi NCR,3-5 yrs,C- Java- IT Risk Management- Vulnerability Assessment- PCI DSS- Cissp...,Senior Consultant - IT Consulting - Information Security (3-5 yrs)  The Firm is seeking to ...,Not disclosed,2018-03-22,3,5,0,0
https://www.naukri.com/job-listings-Freshers-Non-IT-Opening-Voice-Process-Hyderabad-Accenture-Solutions-Pvt-Ltd-Hyderabad-0-to-0-years-210318003515?src=jobsearchDesk&sid=15217229125272&xp=26&px=1,Freshers (Non IT Opening) - Voice Process - Hyderabad,Freshers (Non IT Opening) - Voice Process - Hyderabad,Accenture Solutions Pvt Ltd,Hyderabad,0-0 yrs,non it- voice process- international bpo- call center..., ,Not disclosed,2018-03-22,0,0,0,0
https://www.naukri.com/job-listings-CES-IT-Sr-java-Developer-Scheduled-Walk-in-on-24th-Mar-18-Saturday-CES-Ltd-Hyderabad-Gachibowli-4-to-9-years-200318007841?src=jobsearchDesk&sid=15217229125272&xp=27&px=1,CES IT - Sr.java Developer - Scheduled Walk-in on 24th Mar 18 Saturday,CES IT - Sr.java Developer - Scheduled Walk-in on 24th Mar 18 Saturday,CES Ltd.,Hyderabad(Gachibowli),4-9 yrs,html- javascript- play framework- css- jpa- spring- mysql- grunt- junit...,CES IT - Sr.java Developer - Scheduled Walk-in on 24th Mar 18 Saturday  CES IT - We are ...,900000 - 1800000 P.A.,2018-03-22,4,9,900000,1800000
https://www.naukri.com/job-listings-Cn-strategy-tc-ta-new-IT-9-Accenture-Bengaluru-4-to-8-years-190218902332?src=jobsearchDesk&sid=15217229125272&xp=28&px=1,Cn-strategy-tc-ta-new IT- 9,Cn-strategy-tc-ta-new IT- 9,Accenture,Bengaluru,4-8 yrs,Service- Scrum- Change management- Tools- Business solutions...,About Capability Network:   If you are looking for a career with unparalleled global impact-  then ...,Not disclosed,2018-03-22,4,8,0,0
https://www.naukri.com/job-listings-Route-Trainer-IT-CPM-INDIA-Sales-Marketing-Pvt-Ltd-Delhi-NCR-Jaipur-Pune-2-to-7-years-120318002136?src=jobsearchDesk&sid=15217229125272&xp=29&px=1,Route Trainer - IT,Route Trainer - IT,CPM INDIA Sales  Marketing Pvt Ltd.,Delhi NCR- Jaipur- Pune,2-7 yrs,Field Sales- Sales Training- Product Training- Customer Handling...,TO conduct training related to sales/customer handling/product training to field sales staff. ...,400000 - 425000 P.A.,2018-03-22,2,7,400000,425000
https://www.naukri.com/job-listings-Systems-Engineer-IT-Infrastructure-Fidelity-Business-Service-India-Private-Limited-Chennai-2-to-5-years-090218901474?src=jobsearchDesk&sid=15217229125272&xp=30&px=1,Systems Engineer - IT Infrastructure,Systems Engineer - IT Infrastructure,Fidelity Business Service India Private Limited,Chennai,2-5 yrs,Networking- XenDesktop- XenApp- ITIL Certified- Problem Resolution..., ,Not disclosed,2018-03-22,2,5,0,0
https://www.naukri.com/job-listings-Inside-Sales-Manager-for-IT-Company-Right-Technologies-India-Mumbai-1-to-5-years-260917000866?src=jobsearchDesk&sid=15217229125272&xp=31&px=1,Inside Sales Manager for IT Company,Inside Sales Manager for IT Company,Right Technologies India,Mumbai,1-5 yrs,inside sales,At least 3+ years inside or telemarketing sales experience- or solution selling experience in the ...,250000 - 600000 P.A.,2018-03-22,1,5,250000,600000
https://www.naukri.com/job-listings-Cn-strategy-tc-ta-new-IT-6-Accenture-Gurgaon-2-to-5-years-220318900277?src=jobsearchDesk&sid=15217229125272&xp=32&px=1,Cn-strategy-tc-ta-new IT- 6,Cn-strategy-tc-ta-new IT- 6,Accenture,Gurgaon,2-5 yrs,Scrum- Tools- application architecture- Policies- Management consulting..., ,Not disclosed,2018-03-22,2,5,0,0
https://www.naukri.com/job-listings-Software-Developer-Ruby-on-Rail-with-UK-Based-IT-Company-ITQuest-Consultants-PVT-LTD-Mumbai-Chembur-0-to-2-years-220318003754?src=jobsearchDesk&sid=15217229125272&xp=33&px=1,Software Developer Ruby on Rail  with UK Based IT Company,Software Developer Ruby on Rail  with UK Based IT Company,ITQuest Consultants PVT LTD,Mumbai(Chembur),0-2 yrs,Software Development- Ruby Rails- HTML- CSS- Javascript- Postgresql- MySQL, Develop feature in agile environment using HTML- Ruby on Rails- CSS- Java Script. ...,Not disclosed,2018-03-22,0,2,0,0
https://www.naukri.com/job-listings-Manager-Business-Development-IT-Startup-People-Hire-Consulting-Bengaluru-1-to-6-years-220318002828?src=jobsearchDesk&sid=15217229125272&xp=34&px=1,Manager - Business Development - IT Startup,Manager - Business Development - IT Startup,People Hire Consulting,Bengaluru,1-6 yrs,Sales Consulting- Business Development Management- New Business- Startup...,Roles and responsibilities include- but are not limited to:   Contributing to all major aspects ...,Not disclosed,2018-03-22,1,6,0,0
https://www.naukri.com/job-listings-Manager-Business-Development-Channel-Sales-IT-Jayatram-Business-Solution-Bengaluru-Gurgaon-Mumbai-Gurugram-3-to-7-years-210318901781?src=jobsearchDesk&sid=15217229125272&xp=35&px=1,Manager - Business Development - Channel Sales - IT,Manager - Business Development - Channel Sales - IT,Jayatram Business Solution,Bengaluru- Gurgaon- Mumbai- Gurugram,3-7 yrs,Manager - Business Development- Channel Sales- Sales- Business Development-...,Job Description:  - Responsible for new business development via prospecting high value target ...,Not disclosed,2018-03-22,3,7,0,0
https://www.naukri.com/job-listings-Business-Development-Manager-Enterprise-Sales-IT-Solutions-Jayatram-Business-Solution-Bengaluru-Mumbai-Gurgaon-3-to-7-years-210318900593?src=jobsearchDesk&sid=15217229125272&xp=36&px=1,Business Development Manager - Enterprise Sales - IT Solutions,Business Development Manager - Enterprise Sales - IT Solutions,Jayatram Business Solution,Bengaluru- Mumbai- Gurgaon,3-7 yrs,Business Development Management- Enterprise Sales- Solution Sales...,Title : Business Development Manager- Enterprise Sales  Location : Gurugram/ Gurgaon- Mumbai- ...,Not disclosed,2018-03-22,3,7,0,0
https://www.naukri.com/job-listings-AM-Manager-Talent-Acquisition-IT-Pyramid-HR-Solutions-Noida-1-to-6-years-200318005753?src=jobsearchDesk&sid=15217229125272&xp=37&px=1,AM / Manager - Talent Acquisition - IT,AM / Manager - Talent Acquisition - IT,Pyramid HR Solutions,Noida,1-6 yrs,Manager - Talent Acquisition- Talent Acquisition- head hunting- hiring..., Job Description   - Looking for suave recruitment specialist with strong exposure to ...,Not disclosed,2018-03-22,1,6,0,0
https://www.naukri.com/job-listings-Business-Analyst-Krescent-IT-Labs-Pvt-Ltd-Krescent-IT-labs-Private-Limited-Chandigarh-Mohali-Panchkula-0-to-5-years-271217006648?src=jobsearchDesk&sid=15217229125272&xp=38&px=1,Job Opportunities| Business Analyst| Krescent IT Labs Pvt Ltd,Job Opportunities| Business Analyst| Krescent IT Labs Pvt Ltd,Krescent IT labs Private Limited,Chandigarh- Mohali- Panchkula,0-5 yrs,Business Analysis- User Acceptance Testing- Effort Estimation- Test Lead..., ,100000 - 500000 P.A.,2018-03-22,0,5,100000,500000
https://www.naukri.com/job-listings-Team-Lead-PHP-Krescent-IT-Labs-Pvt-Ltd-Krescent-IT-labs-Private-Limited-Chandigarh-Mohali-Panchkula-3-to-6-years-180118004615?src=jobsearchDesk&sid=15217229125272&xp=39&px=1,Job Opportunities | Team Lead- PHP | Krescent IT Labs Pvt Ltd,Job Opportunities | Team Lead- PHP | Krescent IT Labs Pvt Ltd,Krescent IT labs Private Limited,Chandigarh- Mohali- Panchkula,3-6 yrs,javascript- core php- zoho- API- jquery, ,300000 - 500000 P.A.,2018-03-22,3,6,300000,500000
https://www.naukri.com/job-listings-Hiring-Btech-Fresher-s-For-US-IT-Staffing-Company-Smart-Steps-HR-Services-Noida-0-to-1-years-220318005964?src=jobsearchDesk&sid=15217229125272&xp=40&px=1,Hiring Btech Fresher's For US IT Staffing Company.,Hiring Btech Fresher's For US IT Staffing Company.,Smart Steps HR Services,Noida,0-1 yrs,Technical Recruitment- US IT Staffing- Hiring- Technical Recruiter...,# Responsible for recruiting candidates for US IT companies.    # Core Technical ...,200000 - 250000 P.A.,2018-03-22,0,1,200000,250000
https://www.naukri.com/job-listings-Opening-for-IT-Technical-Recruiter-RANDSTAD-INDIA-PVT-LTD-Bengaluru-1-to-2-years-220318005009?src=jobsearchDesk&sid=15217229125272&xp=41&px=1,Opening for IT Technical Recruiter.,Opening for IT Technical Recruiter.,RANDSTAD INDIA PVT LTD,Bengaluru,1-2 yrs,IT Recruitment- technical recruitment- technical hiring...,Hi All    We have an opening for an IT Recruiter role    Exp;1 ...,100000 - 300000 P.A.,2018-03-22,1,2,100000,300000
https://www.naukri.com/job-listings-US-IT-Recruiter-V-Soft-Consulting-Corporation-Private-Limited-Hyderabad-3-to-6-years-220318003745?src=jobsearchDesk&sid=15217229125272&xp=42&px=1,US IT Recruiter,US IT Recruiter,V-Soft Consulting  Corporation Private Limited,Hyderabad,3-6 yrs,us it recruitment- US IT Recruiter- us technical recruiter,Position - US IT Recruiter Experience - 3 to 6 years( Only Direct clients experience ...,325000 - 550000 P.A.,2018-03-22,3,6,325000,550000
https://www.naukri.com/job-listings-Vacancy-For-HR-Recruiter-non-IT-With-2coms-Consulting-Hyderabad-2Coms-Consulting-Pvt-Ltd-Hyderabad-1-to-3-years-220318003252?src=jobsearchDesk&sid=15217229125272&xp=43&px=1,Vacancy For HR Recruiter(non - IT) With 2coms Consulting Hyderabad,Vacancy For HR Recruiter(non - IT) With 2coms Consulting Hyderabad,2Coms Consulting Pvt Ltd.,Hyderabad,1-3 yrs,non it recruitment- screening- hiring- hr- sourcing- Recruiter- Recruitment...,We Have Urgent Vacancy for HR Recrutier / Sr.HR Recruiter with our Company. Kindly go through below ...,Not disclosed,2018-03-22,1,3,0,0
https://www.naukri.com/job-listings-Urgent-Requirement-for-IT-Recruiter-bangalore-Indranagar-iQuest-Management-Consultants-Pvt-Ltd-Bengaluru-Indra-Nagar-0-to-3-years-220318003015?src=jobsearchDesk&sid=15217229125272&xp=44&px=1,Urgent Requirement for IT Recruiter /bangalore Indranagar,Urgent Requirement for IT Recruiter /bangalore Indranagar,iQuest Management Consultants Pvt. Ltd,Bengaluru(Indra Nagar),0-3 yrs,it recruitment- it recruiter- talent acquisition- sourcing- recruitment...,1. Handling the complete recruitment and selection process- right from crystallizing the requirement ...,175000 - 300000 P.A. Fixed salary +incentives,2018-03-22,0,3,175000,300000
https://www.naukri.com/job-listings-Opening-fresher-it-mumbai-goregaon-immediate-Joinee-Growel-Softech-Pvt-Ltd-Mumbai-0-to-1-years-220318000884?src=jobsearchDesk&sid=15217229125272&xp=45&px=1,Job Opening-fresher-it-mumbai-goregaon-immediate Joinee,Job Opening-fresher-it-mumbai-goregaon-immediate Joinee,Growel Softech Pvt. Ltd.,Mumbai,0-1 yrs,Fresher- It Fresher- B.E.- B Tech Fresher- MCA- BCA- B Sc - IT- B Sc IT, We have urgent opening for our ...,200000 - 250000 P.A.,2018-03-22,0,1,200000,250000
https://www.naukri.com/job-listings-Asst-Manager-Technology-IT-Recruitment-team-Handling-Exp-must-ABC-Consultants-Pvt-Ltd-Mumbai-8-to-13-years-220318000866?src=jobsearchDesk&sid=15217229125272&xp=46&px=1,Asst. Manager - Technology (IT) Recruitment (team Handling Exp.must ),Asst. Manager - Technology (IT) Recruitment (team Handling Exp.must ),ABC Consultants Pvt Ltd,Mumbai,8-13 yrs,it recruitment- team handling- technology recruitment...,Role - Assistant Manager - Technology (IT) Recruitment.    Location Mumbai ...,800000 - 1100000 P.A.,2018-03-22,8,13,800000,1100000
https://www.naukri.com/job-listings-Head-Technology-Project-IT-Systems-Infrastructure-Bengaluru-4-to-9-years-200318901808?src=jobsearchDesk&sid=15217229125272&xp=47&px=1,Head - Technology Project - IT Systems & Infrastructure,Head - Technology Project - IT Systems & Infrastructure,Premium,Bengaluru,4-9 yrs,IT Governance- Information Technology- IT Strategy- IT Infrastructure...,Head - Technology Project - IT Systems & Infrastructure (4-10 yrs)   Qualification B.Tech/B.E ...,Not disclosed,2018-03-22,4,9,0,0
https://www.naukri.com/job-listings-Hiring-IT-Helpdesk-IT-Service-Desk-TSR-TSE-TSO-in-Tcs-HP-Y-C-Padhmanaba-Bengaluru-0-to-5-years-170118000241?src=jobsearchDesk&sid=15217229125272&xp=48&px=1,Hiring IT Helpdesk / IT Service Desk / TSR / TSE / TSO in Tcs / HP.,Hiring IT Helpdesk / IT Service Desk / TSR / TSE / TSO in Tcs / HP.,Y.C.Padhmanaba,Bengaluru,0-5 yrs,technical associate- ites- it service desk- technical executive...,  *CANDIDATES PLEASE NOTE : CALLS HAVE TO BE MADE TO OUR DESIGNATED RECRUITMENT CONSULTANTS ...,175000 - 400000 P.A. Salary Hikes / Incentives / Ni...,2018-03-22,0,5,175000,400000
