https://www.naukri.com/job-listings-Network-Operations-Lead-L2-Gurgaon-Leading-IT-Client-iAccess-Solutions-Pvt-Ltd-Gurgaon-8-to-12-years-210318007784?src=jobsearchDesk&sid=15217229215496&xp=2&px=4,Network Operations Lead (L2) || Gurgaon || Leading IT Client,Network Operations Lead (L2) || Gurgaon || Leading IT Client,iAccess Solutions Pvt. Ltd,Gurgaon,8-12 yrs,Network Operations- Networking- MPLS- vpn- checkpoint- CCNA- ITIL..., Experience: 8- 12 Years   Location: Sector 52- Gurgaon ( Permanent opportunity with ...,300000 - 800000 P.A.,2018-03-21,8,12,300000,800000
https://www.naukri.com/job-listings-Sr-NET-Developer-for-a-Bhandup-Mumbai-Based-IT-Company-JADAS-Consulting-Services-Mumbai-LBS-Marg-4-to-9-years-070318003866?src=jobsearchDesk&sid=15217229215496&xp=3&px=4,Sr. NET Developer for a Bhandup - Mumbai Based IT Company,Sr. NET Developer for a Bhandup - Mumbai Based IT Company,JADAS Consulting Services,Mumbai(LBS Marg),4-9 yrs,Ajax- Javascript- CSS- JQuery- HTML- ASP.Net- SQL Server- C#- Xamarin, ,600000 - 700000 P.A. Statutory Benefits & Mediclaim...,2018-03-22,4,9,600000,700000
https://www.naukri.com/job-listings-Deputy-Manager-IT-Production-Support-HDFC-Standard-Life-Insurance-Company-Ltd-Mumbai-4-to-9-years-161017002971?src=jobsearchDesk&sid=15217229215496&xp=4&px=4,Deputy Manager - IT Production Support,Deputy Manager - IT Production Support,HDFC Standard Life Insurance Company Ltd,Mumbai,4-9 yrs,SQL Queries- Production Support- Problem Solving- MYSQL, Overall purpose of the Job:   Provide Production Support for E-Commerce and Digital ...,Not disclosed,2018-03-21,4,9,0,0
https://www.naukri.com/job-listings-Marketing-Intern-For-an-IT-Company-in-Pune-Baner-Careers-Unlimited-Pune-Baner-0-to-0-years-220318002310?src=jobsearchDesk&sid=15217229215496&xp=5&px=4,Marketing Intern For an IT Company in Pune - Baner,Marketing Intern For an IT Company in Pune - Baner,Careers Unlimited,Pune(Baner),0-0 yrs,marketing- Digital MArketing- Branding, ,125000 - 175000 P.A. Stipend.,2018-03-22,0,0,125000,175000
https://www.naukri.com/job-listings-Looking-for-Freshers-NON-IT-night-Shifts-Cogent-Data-Solutions-LLC-Hyderabad-Madhapur-0-to-0-years-120318008888?src=jobsearchDesk&sid=15217229215496&xp=6&px=4,Looking for Freshers NON IT - (night Shifts),Looking for Freshers NON IT - (night Shifts),Cogent Data Solutions LLC,Hyderabad(Madhapur),0-0 yrs,Linkedin- Client Interaction- Social Media- Communication Skills...,Pleasant Greetings from Cogent Data Solutions Pvt Ltd...!!!!  Golden opportunity for Engineering ...,100000 - 200000 P.A.,2018-03-21,0,0,100000,200000
https://www.naukri.com/job-listings-Walk-in-For-HR-IT-Recruiter-Exp-0-6-1-Year-SPARX-IT-SOLUTIONS-PRIVATE-LIMITED-Noida-0-to-3-years-210318002700?src=jobsearchDesk&sid=15217229215496&xp=7&px=4,Walk in For HR IT Recruiter (Exp 0.6 -1 Year),Walk in For HR IT Recruiter (Exp 0.6 -1 Year),SPARX IT SOLUTIONS PRIVATE LIMITED,Noida,0-3 yrs,recruitment- it recruitment- it talent acquisition- recruiter..., ,Not disclosed,2018-03-21,0,3,0,0
https://www.naukri.com/job-listings-IT-Storage-Engineer-Nvidia-Graphics-Pvt-Ltd-Bengaluru-7-to-10-years-220318900144?src=jobsearchDesk&sid=15217229215496&xp=8&px=4,IT Storage Engineer,IT Storage Engineer,Nvidia Graphics Pvt. Ltd.,Bengaluru,7-10 yrs,IT Storage Engineer- VNX- VMAX- NetApp- Oracle ZFS- NFS- CIFS- automounter-...,NVIDIA is seeking passionate and highly motivated storage engineers to be part of storage team working ...,Not disclosed,2018-03-22,7,10,0,0
https://www.naukri.com/job-listings-US-IT-Recruiter-DEVVIK-LLC-Chennai-Bengaluru-Hyderabad-1-to-6-years-210318009401?src=jobsearchDesk&sid=15217229215496&xp=9&px=4,US IT Recruiter,US IT Recruiter,DEVVIK LLC,Chennai- Bengaluru- Hyderabad,1-6 yrs,bench sales- linkedin- twitter- facebook- marketing- social media...,  Job Description (This position is for our Chennai Office only)      We ...,250000 - 500000 P.A.,2018-03-21,1,6,250000,500000
https://www.naukri.com/job-listings-IT-Recruiter-ASM-Technologies-Ltd-Bengaluru-1-to-3-years-220318004736?src=jobsearchDesk&sid=15217229215496&xp=10&px=4,IT Recruiter,IT Recruiter,ASM Technologies Ltd,Bengaluru,1-3 yrs,IT Recruitment- Screening- Interviewing- Interview Scheduling,Core Competencies:-  Screening  Interaction with Candidate  Follow-up  Maintain Reports ...,100000 - 400000 P.A.,2018-03-22,1,3,100000,400000
https://www.naukri.com/job-listings-Urgent-Position-for-IT-Analyst-Role-Ebizon-Net-Info-Pvt-Ltd-Noida-0-to-2-years-210318008597?src=jobsearchDesk&sid=15217229215496&xp=11&px=4,Urgent Position for IT Analyst Role.,Urgent Position for IT Analyst Role.,Ebizon Net Info Pvt Ltd,Noida,0-2 yrs,MySQL- PHP- Zabbix- Open Source- Linux Server- AWS- NAGIOS- Ansible- Docker..., Job Description:-       Cloud and remote infrastructure ...,Not disclosed,2018-03-21,0,2,0,0
https://www.naukri.com/job-listings-Walk-In-Drive-for-IT-Positions-in-Black-Knight-for-Bhuabneshwar-Locati-Black-Knight-India-Solutions-Private-Limited-Bhubaneshwar-5-to-8-years-210318008395?src=jobsearchDesk&sid=15217229215496&xp=12&px=4,Walk In Drive for IT Positions in Black Knight for Bhuabneshwar Locati,Walk In Drive for IT Positions in Black Knight for Bhuabneshwar Locati,Black Knight India Solutions Private Limited,Bhubaneshwar,5-8 yrs,Networking- Sharepoint Development- C#- Aix Administration...,Hi-   Greetings from Black knight- A Captive Product Development Company- We have immediate ...,400000 - 700000 P.A.,2018-03-21,5,8,400000,700000
https://www.naukri.com/job-listings-Walkin-Drive-for-Equity-Dealer-Thane-Ashar-IT-Park-Reliance-Capital-Limited-Mumbai-Navi-Mumbai-1-to-4-years-210318007432?src=jobsearchDesk&sid=15217229215496&xp=13&px=4,Walkin Drive for Equity Dealer : Thane Ashar IT Park,Walkin Drive for Equity Dealer : Thane Ashar IT Park,Reliance Capital Limited,Mumbai- Navi Mumbai,1-4 yrs,Equity Market- Derivatives- Finance- NISM- NCFM- Banking- Broking- Dealing-..., ,200000 - 350000 P.A. +incentives & Allowances,2018-03-21,1,4,200000,350000
https://www.naukri.com/job-listings-Hiring-Fresher-s-for-IT-Inside-Sales-Executive-on-22nd-23rd-March-Polestar-Solutions-And-Services-India-Pvt-Ltd-Delhi-NCR-0-to-0-years-210318006958?src=jobsearchDesk&sid=15217229215496&xp=14&px=4,Hiring Fresher's for IT Inside Sales Executive on 22nd & 23rd March,Hiring Fresher's for IT Inside Sales Executive on 22nd & 23rd March,Polestar Solutions And Services India Pvt. Ltd.,Delhi NCR,0-0 yrs,Inside Sales- Cold Calling- Social Media- IT Services- MS Office...,  Inside sales executive           Hiring ...,200000 - 225000 P.A.,2018-03-21,0,0,200000,225000
https://www.naukri.com/job-listings-Urgnt-Req-Process-Coordinatior-for-IT-Department-for-Leading-Mfg-Co-MITTAL-ELECTRONICS-Delhi-NCR-1-to-6-years-210318006149?src=jobsearchDesk&sid=15217229215496&xp=15&px=4,Urgnt. Req. Process Coordinatior for IT Department for Leading Mfg Co.,Urgnt. Req. Process Coordinatior for IT Department for Leading Mfg Co.,MITTAL ELECTRONICS,Delhi NCR,1-6 yrs,Process Coordinator,Urgently required Process Coordinator IT for North Delhi Location    Must be ...,50000 - 200000 P.A.,2018-03-21,1,6,50000,200000
https://www.naukri.com/job-listings-Urgent-Requirement-of-IT-Executive-system-Administrator-at-Jaipur-Soncoya-Solutions-Private-Limited-Jaipur-2-to-5-years-210318005635?src=jobsearchDesk&sid=15217229215496&xp=16&px=4,Urgent Requirement of IT Executive/system Administrator at Jaipur,Urgent Requirement of IT Executive/system Administrator at Jaipur,Soncoya Solutions Private Limited,Jaipur,2-5 yrs,networking- terminal services- active directory- desktop support...,-Server-side support Installation and troubleshooting of Linux and various open source applications. ...,200000 - 250000 P.A.,2018-03-21,2,5,200000,250000
https://www.naukri.com/job-listings-Full-Time-Academic-Writer-for-Computer-Science-Cs-it-Paperpedia-private-limited-Delhi-NCR-Sector-16-Noida-Delhi-Ghaziabad-Greater-Noida-Gurgaon-Noida-0-to-3-years-210318005178?src=jobsearchDesk&sid=15217229215496&xp=17&px=4,Full Time Academic Writer for Computer Science - Cs/it,Full Time Academic Writer for Computer Science - Cs/it,Paperpedia private limited,Delhi NCR(Sector-16 Noida)- Delhi- Ghaziabad- Greater Noida- Gurgaon- Noida,0-3 yrs,academic research- academic writer- research- reports- Python- Java...,We are currently seeking experienced as well as fresher writers to join our team for the role of ...,350000 - 600000 P.A.,2018-03-21,0,3,350000,600000
https://www.naukri.com/job-listings-IT-Helpdesk-Analyst-Blackbelt-Help-Gurgaon-1-to-6-years-210318005108?src=jobsearchDesk&sid=15217229215496&xp=18&px=4,IT Helpdesk Analyst,IT Helpdesk Analyst,Blackbelt Help,Gurgaon,1-6 yrs,windows- ms outlook- it helpdesk- ms office- operating systems...,Position Name - IT Helpdesk Analyst   Location - Gurgaon   Shift Timings - 5:30 PM - 2:30 ...,375000 - 800000 P.A.,2018-03-21,1,6,375000,800000
https://www.naukri.com/job-listings-Recruitments-Non-It-bpo-Hiring-Spectrum-Talent-Management-Noida-0-to-2-years-210318004504?src=jobsearchDesk&sid=15217229215496&xp=19&px=4,Recruitments Non It(bpo Hiring),Recruitments Non It(bpo Hiring),Spectrum Talent Management,Noida,0-2 yrs,non it recruitment- BPO Hiring- bulk hiring- bulk recruitment- mass hiring,     Hi All-  We are hiring for  NON IT(BPO Hiring)  ...,100000 - 275000 P.A.,2018-03-21,0,2,100000,275000
https://www.naukri.com/job-listings-IT-Project-Manager-Immediate-Joniee-Flatrions-solutions-India-Pvt-Ltd-Chennai-OMR-12-to-17-years-210318003319?src=jobsearchDesk&sid=15217229215496&xp=20&px=4,IT Project Manager/ Immediate Joniee,IT Project Manager/ Immediate Joniee,Flatrions solutions India Pvt Ltd,Chennai(OMR),12-17 yrs,core java- it project management- pmp trained- Agile Project Management...,Flatirons Solutions is currently looking for a IT Project manager    Address: ...,1400000 - 1800000 P.A.,2018-03-21,12,17,1400000,1800000
https://www.naukri.com/job-listings-Immediate-Hiring-for-Advisior-IT-Development-Bangalore-Ecentric-Solutions-Pvt-Ltd-Bengaluru-8-to-11-years-210318003155?src=jobsearchDesk&sid=15217229215496&xp=21&px=4,Immediate Hiring for Advisior IT Development- Bangalore,Immediate Hiring for Advisior IT Development- Bangalore,Ecentric Solutions Pvt. Ltd.,Bengaluru,8-11 yrs,devops- cloud, ,500000 - 950000 P.A.,2018-03-21,8,11,500000,950000
https://www.naukri.com/job-listings-US-IT-Recruiter-Fujitsu-Consulting-India-Pvt-Ltd-Chennai-1-to-4-years-210318003154?src=jobsearchDesk&sid=15217229215496&xp=22&px=4,US IT Recruiter,US IT Recruiter,Fujitsu Consulting India Pvt. Ltd.,Chennai,1-4 yrs,US IT Recruitment- us staffing- us it recruiter- Sourcing, Greetings From Fujitsu.     We are hiring for US IT Recruiter for ...,Not disclosed,2018-03-21,1,4,0,0
https://www.naukri.com/job-listings-Looking-for-IT-sr-IT-Hyderabad-Location-Zen3-Info-Solutions-Private-Limited-Hyderabad-Gachibowli-2-to-5-years-210318002965?src=jobsearchDesk&sid=15217229215496&xp=23&px=4,Looking for IT Recruiters/sr. IT Recruiters @ Hyderabad Location,Looking for IT Recruiters/sr. IT Recruiters @ Hyderabad Location,Zen3 Info Solutions Private Limited.,Hyderabad(Gachibowli),2-5 yrs,screening- interview coordination- hiring- sourcing- strategic sourcing- It...,  Partnering with hiring managers to determine staffing needs  Screening resumes ...,Not disclosed,2018-03-21,2,5,0,0
https://www.naukri.com/job-listings-Inside-Sales-Voice-Chat-Email-Support-Executive-IT-Sales-Myraah-IO-Pune-Viman-Nagar-0-to-4-years-210318001923?src=jobsearchDesk&sid=15217229215496&xp=24&px=4,Inside Sales / Voice / Chat / Email Support Executive / IT Sales,Inside Sales / Voice / Chat / Email Support Executive / IT Sales,Myraah IO,Pune(Viman Nagar),0-4 yrs,it sales- email support- non voice- inside sales- cold calling- tele sales-...,Excellent Oppurtunity in Inside Sales / Voice / Non Voice / Chat Process / Email Support / Fresher/ With ...,175000 - 250000 P.A.,2018-03-21,0,4,175000,250000
https://www.naukri.com/job-listings-Lead-IT-Network-and-Security-Operations-Reliance-Capital-Limited-Mumbai-10-to-12-years-210318000795?src=jobsearchDesk&sid=15217229215496&xp=25&px=4,Lead - IT Network and Security Operations,Lead - IT Network and Security Operations,Reliance Capital Limited,Mumbai,10-12 yrs,LAN Networking- WAN- Network Security- IT Infrastructure- IT Networking..., ,Not disclosed,2018-03-21,10,12,0,0
https://www.naukri.com/job-listings-Lead-IT-Infrastructure-and-Security-Operations-Reliance-Capital-Limited-Mumbai-10-to-12-years-210318000713?src=jobsearchDesk&sid=15217229215496&xp=26&px=4,Lead - IT Infrastructure and Security Operations,Lead - IT Infrastructure and Security Operations,Reliance Capital Limited,Mumbai,10-12 yrs,Infrastructure Security- Security Operations- Managed Services..., ,Not disclosed,2018-03-21,10,12,0,0
https://www.naukri.com/job-listings-IT-Security-Engineer-IFINTALENT-GLOBAL-PVT-LTD-Bengaluru-Hyderabad-10-to-14-years-210318000290?src=jobsearchDesk&sid=15217229215496&xp=27&px=4,IT Security Engineer,IT Security Engineer,IFINTALENT GLOBAL PVT LTD,Bengaluru- Hyderabad,10-14 yrs,Networking- Group Policy- Adfs- Active Directory- PKI- Identity Management-...,o	8+ years experience with Active Directory (2008+)- Kerberos- Group Policy- LDAP o	Proven ...,Not disclosed,2018-03-21,10,14,0,0
https://www.naukri.com/job-listings-IT-Web-Developer-ELS-International-Education-Pathways-Pvt-Ltd-Chennai-Mylapore-3-to-5-years-091217002086?src=jobsearchDesk&sid=15217229215496&xp=28&px=4,IT Web Developer,IT Web Developer,ELS International Education Pathways Pvt Ltd,Chennai(Mylapore),3-5 yrs,application programming- sql programmer- asp.net web developer- sitecore...,   IT Web Developer is responsible for developing enhancements- running tests- ...,Not disclosed,2018-03-21,3,5,0,0
https://www.naukri.com/job-listings-IT-Project-Manager-Mumbai-Synophic-Systems-Private-Limited-Mumbai-10-to-16-years-220318002529?src=jobsearchDesk&sid=15217229215496&xp=29&px=4,IT Project Manager- Mumbai,IT Project Manager- Mumbai,Synophic Systems Private Limited,Mumbai,10-16 yrs,IT Project Management,    Hi All-  Please find the JD below  1.	Experience in the field of ...,700000 - 1100000 P.A.,2018-03-22,10,16,700000,1100000
https://www.naukri.com/job-listings-IT-Project-Manager-mumbai-Vara-United-Pvt-Ltd-Mumbai-8-to-11-years-220318001978?src=jobsearchDesk&sid=15217229215496&xp=30&px=4,IT Project Manager-mumbai,IT Project Manager-mumbai,Vara United Pvt Ltd,Mumbai,8-11 yrs,it project management- planning- business strategy- risk management...,Greetings from Vara United!!    We have an exciting opportunity with a Banking ...,Not disclosed,2018-03-22,8,11,0,0
https://www.naukri.com/job-listings-Developers-IT-Swagene-Startup-Chennai-3-to-7-years-210318900971?src=jobsearchDesk&sid=15217229215496&xp=31&px=4,Developers - IT,Developers - IT,Swagene - Startup,Chennai,3-7 yrs,React.Js- Node.Js- Nginx- Web Technologies- Big Data- Web Application...,-Node.js- Express.js- React.js- Document/Graph Databases -You will design and build a comprehensive ...,Not disclosed,2018-03-21,3,7,0,0
https://www.naukri.com/job-listings-Walk-in-Net-Developer-only-Male-Binary-Semantics-Ltd-IT-Com-Binary-Semantics-Limited-Gurgaon-3-to-6-years-210318002769?src=jobsearchDesk&sid=15217229215496&xp=32&px=4,Walk-in|| .Net Developer (only Male) || Binary Semantics Ltd.( IT Com),Walk-in|| .Net Developer (only Male) || Binary Semantics Ltd.( IT Com),Binary Semantics Limited,Gurgaon,3-6 yrs,ASP.Net- SQL- OOPS- JavaScript- JQuery- ajax,Dear Candidate-  *Greetings from Binary Semantics   *Please write Raj Mangala @ top ...,200000 - 700000 P.A.,2018-03-21,3,6,200000,700000
https://www.naukri.com/job-listings-IT-Recruiter-Infobahn-Softworld-India-LLP-Chennai-1-to-4-years-200318008289?src=jobsearchDesk&sid=15217229215496&xp=33&px=4,IT Recruiter,IT Recruiter,Infobahn Softworld India LLP,Chennai,1-4 yrs,IT Recruitment- Contract Staffing- Hiring- recruitment,We are hiring for IT Recruiters who has very good experience in Contract Staffing hiring for service ...,Not disclosed,2018-03-22,1,4,0,0
https://www.naukri.com/job-listings-IT-Solutions-Management-IV-B4-Applied-Materials-India-Private-Limited-Bengaluru-10-to-12-years-190118900915?src=jobsearchDesk&sid=15217229215496&xp=34&px=4,IT Solutions Management IV - (B4),IT Solutions Management IV - (B4),Applied Materials India Private Limited,Bengaluru,10-12 yrs,SQL- Python- Workflow- Analytics- Data analysis- Machine learning- Tools...,  Responsibilities:           Design experiments-  test hypotheses-  and build ...,Not disclosed,2018-03-22,10,12,0,0
https://www.naukri.com/job-listings-BSC-IT-Fresher-as-Claim-Processing-Executive-for-US-Company-NDS-Infoserv-Mumbai-0-to-2-years-160318000837?src=jobsearchDesk&sid=15217229215496&xp=35&px=4,BSC IT Fresher as Claim Processing Executive for US Company,BSC IT Fresher as Claim Processing Executive for US Company,NDS Infoserv,Mumbai,0-2 yrs,Fresher,Dear-  Exciting opportunity to work for a fast growing company serving the needs of Fortune 500 ...,100000 - 150000 P.A. Incentives Drop Facility to n...,2018-03-21,0,2,100000,150000
https://www.naukri.com/job-listings-IT-Product-Based-Co-Looking-For-Smart-Java-Developers-Mumbai-EMEASUREMATICS-PVT-LTD-Mumbai-3-to-8-years-230218004615?src=jobsearchDesk&sid=15217229215496&xp=36&px=4,IT Product Based Co Looking For Smart Java Developers- Mumbai,IT Product Based Co Looking For Smart Java Developers- Mumbai,EMEASUREMATICS PVT LTD,Mumbai,3-8 yrs,Spring Mvc- J2Ee- Hibernate- Core Java- J2Se- Javascript- Design Patterns...,We are seeking highly-skilled- experienced Java developers to join our expanding product development ...,Not disclosed,2018-03-22,3,8,0,0
https://www.naukri.com/job-listings-IT-Recruiter-Next-Step-Services-Private-Limited-Gurgaon-3-to-7-years-210318007794?src=jobsearchDesk&sid=15217229215496&xp=37&px=4,IT Recruiter,IT Recruiter,Next Step Services Private Limited,Gurgaon,3-7 yrs,it recruitment- technical recruitment- screening- Talent Acquisition...,Total Experience :4-7 Years Job Location : Gurgaon  4 to 7 years of experience into ...,Not disclosed,2018-03-21,3,7,0,0
https://www.naukri.com/job-listings-Hiring-for-Vendor-Relations-Executive-Ergode-IT-Services-Ergode-IT-Services-Pvt-Ltd-Mumbai-Mulund-0-to-2-years-210318000392?src=jobsearchDesk&sid=15217229215496&xp=38&px=4,Hiring for Vendor Relations Executive | Ergode IT Services,Hiring for Vendor Relations Executive | Ergode IT Services,Ergode IT Services Pvt Ltd,Mumbai(Mulund),0-2 yrs,negotiation skills- vendor management- vendor relations- vendor assessment-..., ,100000 - 200000 P.A.,2018-03-21,0,2,100000,200000
https://www.naukri.com/job-listings-Hiring-US-IT-Recuiters-technical-FCS-Software-Solutions-Limited-Noida-Sector-57-Noida-0-to-2-years-190118004757?src=jobsearchDesk&sid=15217229215496&xp=39&px=4,Hiring US IT Recuiters/technical Recruiters,Hiring US IT Recuiters/technical Recruiters,FCS Software Solutions Limited,Noida(Sector-57 Noida),0-2 yrs,Technical Recruitment- HR- Screening- Sourcing- Recruitment Consulting..., FCS Software Solutions Ltd.  are eagerly looking for  Technical Recruiter  for its Noida ...,175000 - 300000 P.A. Incentives+meal Reimbursement+...,2018-03-22,0,2,175000,300000
https://www.naukri.com/job-listings-US-IT-Excellent-Career-Opportunities-at-Madhapur-SRS-Business-Solutions-India-Pvt-Ltd-Hyderabad-Madhapur-2-to-6-years-080318007099?src=jobsearchDesk&sid=15217229215496&xp=40&px=4,US IT Recruiters - Excellent Career Opportunities at Madhapur,US IT Recruiters - Excellent Career Opportunities at Madhapur,SRS Business Solutions (India) Pvt. Ltd.,Hyderabad(Madhapur),2-6 yrs,US IT Recruitment- US Staffing- us recruitment- w2- corp - corp..., Greetings from SRS ...,200000 - 600000 P.A.,2018-03-22,2,6,200000,600000
https://www.naukri.com/job-listings-Urgent-Hiring-for-IT-Recruiter-for-New-Delhi-Location-night-Shift-Confidential-Delhi-NCR-Kalkaji-0-to-4-years-210318008760?src=jobsearchDesk&sid=15217229215496&xp=41&px=4,Urgent Hiring for IT Recruiter for New Delhi Location(night Shift),Urgent Hiring for IT Recruiter for New Delhi Location(night Shift),Confidential,Delhi NCR(Kalkaji),0-4 yrs,it recruitment- night shift- US IT Recruitment- US IT Staffing- Bench Sales...,Mail ur updated resume on Shalini@busitants.com    Call @ 011 49028445 ...,Not disclosed,2018-03-21,0,4,0,0
https://www.naukri.com/job-listings-Immediate-Joiners-It-wfh-Any-Location-females-Only-Orcapod-Consulting-Services-Private-Limited-Delhi-NCR-Mumbai-Pune-1-to-6-years-210318008159?src=jobsearchDesk&sid=15217229215496&xp=42&px=4,Immediate Joiners- It-recruiters-wfh- Any Location-females Only,Immediate Joiners- It-recruiters-wfh- Any Location-females Only,Orcapod Consulting Services Private Limited,Delhi NCR- Mumbai- Pune,1-6 yrs,IT Recruiter- Technical Recruitment- it recruitment- technical hiring..., We have requirement for the position of Technical recruiter/ Sr. technical recruiter (Work from ...,Not disclosed,2018-03-21,1,6,0,0
https://www.naukri.com/job-listings-Urgent-Hiring-for-US-NON-IT-Recruiter-Cab-Provied-Bcforward-Hyd-BCFORWARD-INDIA-TECHNOLOGIES-PRIVATE-LIMITED-Hyderabad-Kukatpally-1-1-to-6-years-210318006956?src=jobsearchDesk&sid=15217229215496&xp=43&px=4,Urgent Hiring for US NON  IT Recruiter -Cab Provied- Bcforward Hyd,Urgent Hiring for US NON  IT Recruiter -Cab Provied- Bcforward Hyd,BCFORWARD INDIA TECHNOLOGIES PRIVATE LIMITED,Hyderabad(Kukatpally+1),1-6 yrs,us it recruitment- screening- staffing- non it- people skills- social media..., Job Role:  Non-IT Recruiter  Location:  Kukatpally-Hyderabad  Duration: ...,Not disclosed,2018-03-21,1,6,0,0
https://www.naukri.com/job-listings-Immediate-Opportunity-For-IT-Non-IT-Bangalore-Mumbai-RANDSTAD-INDIA-PVT-LTD-Mumbai-Bengaluru-5-to-10-years-210318006337?src=jobsearchDesk&sid=15217229215496&xp=44&px=4,Immediate Opportunity For IT / Non IT Recruiters - Bangalore & Mumbai,Immediate Opportunity For IT / Non IT Recruiters - Bangalore & Mumbai,RANDSTAD INDIA PVT LTD,Mumbai- Bengaluru,5-10 yrs,IT Recruitment- technical recruitment- technical hiring- it hiring...,Graduate / Post Graduate with min 5 + years of experience in IT / Non IT Recruitment  ...,Not disclosed,2018-03-21,5,10,0,0
https://www.naukri.com/job-listings-US-IT-Recruiter-US-Tech-Solutions-Pvt-Ltd-Hyderabad-1-to-5-years-210318006187?src=jobsearchDesk&sid=15217229215496&xp=45&px=4,US IT Recruiter,US IT Recruiter,US Tech Solutions Pvt Ltd,Hyderabad,1-5 yrs,us it recruiter- w2- 1099- VMS- MSP- us recruiter- us staffing..., Job Title:  US IT Recruiter Location:  Hyderabad Shift Hours: Night Shift ...,Not disclosed,2018-03-21,1,5,0,0
https://www.naukri.com/job-listings-Urgent-Opening-for-IT-Recruiter-Noida-Sec1-5-Days-Working-Vanguard-HR-Associates-Pvt-Ltd-Noida-1-to-5-years-210318005146?src=jobsearchDesk&sid=15217229215496&xp=46&px=4,Urgent Opening for IT Recruiter - Noida Sec1- 5 Days Working,Urgent Opening for IT Recruiter - Noida Sec1- 5 Days Working,Vanguard HR Associates Pvt Ltd.,Noida,1-5 yrs,IT Recruitment- IT Recruiter- Technical Recruitment,Hi-  With reference to your CV- you have been considered for a job opening with a Vanguard HR ...,200000 - 350000 P.A. Decent hike on Current CTC,2018-03-21,1,5,200000,350000
https://www.naukri.com/job-listings-Technical-Manager-Python-9-16-Years-IT-MNC-Noida-Urgent-PROWESS-India-Consulting-Services-Noida-Delhi-9-to-14-years-210318001320?src=jobsearchDesk&sid=15217229215496&xp=47&px=4,Technical Manager - Python | 9-16 Years | IT MNC | Noida ( Urgent ),Technical Manager - Python | 9-16 Years | IT MNC | Noida ( Urgent ),PROWESS India Consulting Services,Noida- Delhi,9-14 yrs,HTML- CSS- Javascript- Web Services- SQL- Python- Web Technologies...,Explore career opportunity with a new breed of digital product development company borne from the world ...,Not disclosed,2018-03-21,9,14,0,0
https://www.naukri.com/job-listings-IT-Recruiter-amIT-Global-Solutions-Pvt-Ltd-Chennai-1-to-6-years-210318000903?src=jobsearchDesk&sid=15217229215496&xp=48&px=4,IT Recruiter,IT Recruiter,amIT Global Solutions Pvt Ltd,Chennai,1-6 yrs,it recruitment- head hunting- screening- sourcing- it recruiter...,  Job Description      Candidate with good experience in IT ...,Not disclosed,2018-03-21,1,6,0,0
https://www.naukri.com/job-listings-Looking-for-IT-New-Era-India-Consultancy-Pvt-Ltd-Delhi-Okhla-1-to-3-years-210218005159?src=jobsearchDesk&sid=15217229215496&xp=49&px=4,Looking for IT Recruiters,Looking for IT Recruiters,New Era India Consultancy Pvt. Ltd.,Delhi(Okhla),1-3 yrs,Cloud Computing- Azure- IT- Technical recruiter- technical recruitment...,Dear Candidates-    We are looking for smart IT Technical Recruiters. ...,200000 - 300000 P.A.,2018-03-21,1,3,200000,300000
https://www.naukri.com/job-listings-IT-Recruiter-US-Staffing-international-Resourcing-Agreeya-Solutions-India-Private-Limited-Noida-2-to-5-years-231017005032?src=jobsearchDesk&sid=15217229215496&xp=50&px=4,IT Recruiter-  US Staffing\international Resourcing,IT Recruiter-  US Staffing\international Resourcing,Agreeya Solutions India Private Limited,Noida,2-5 yrs,us staffing- us it recruiter- corp to corp- us recruiter- w2...,   Recruiter\Senior Recruiter- International Resourcing    Must have: ...,Not disclosed,2018-03-21,2,5,0,0
https://www.naukri.com/job-listings-IT-Recruitment-Consultant-bellandur-Careernet-Technologies-Pvt-Ltd-Bengaluru-1-to-6-years-150318002460?src=jobsearchDesk&sid=1521722924678&xp=1&px=5,IT Recruitment Consultant_bellandur,IT Recruitment Consultant_bellandur,Careernet Technologies Pvt Ltd,Bengaluru,1-6 yrs,recruitment consulting- shortlisting- head hunting- screening- sourcing...,Job Description: Looking for IT Product Recruitment Consultant ( Product- Startup- Ecommerce- ...,Not disclosed,2018-03-21,1,6,0,0
