https://www.naukri.com/job-listings-Assured-IT-After-Completion-of-Training-MARS-Placements-Services-Chandigarh-Mohali-0-to-0-years-280717007117?src=jobsearchDesk&sid=15217229318605&xp=5&px=7,Assured IT Job After Completion of Training,Assured IT Job After Completion of Training,MARS Placements Services,Chandigarh- Mohali,0-0 yrs,Providing Training, ,Not disclosed,2018-03-21,0,0,0,0
https://www.naukri.com/job-listings-US-IT-Recruiter-Bangalore-Traverze-Consultancy-Solutions-Pvt-Ltd-Bengaluru-3-to-6-years-271017005460?src=jobsearchDesk&sid=15217229318605&xp=6&px=7,US IT Recruiter - Bangalore,US IT Recruiter - Bangalore,Traverze Consultancy Solutions Pvt Ltd.,Bengaluru,3-6 yrs,US IT Recruitment- W2- Corp- Us Tax- dice- monster- career builder- indeed-..., ,Not disclosed,2018-03-21,3,6,0,0
https://www.naukri.com/job-listings-HR-Recruiter-non-it-HR-Lead-IT-Non-it-Both-Unison-International-Consulting-Pvt-Ltd-Gurgaon-2-to-7-years-210318007286?src=jobsearchDesk&sid=15217229318605&xp=7&px=7,HR Recruiter (non-it) & HR - Lead (IT & Non-it Both),HR Recruiter (non-it) & HR - Lead (IT & Non-it Both),Unison International Consulting Pvt. Ltd,Gurgaon,2-7 yrs,Recruitment- HR- Non It- recruiter, ,600000 - 1400000 P.A.,2018-03-21,2,7,600000,1400000
https://www.naukri.com/job-listings-Business-Analyst-IT-Technology-Cpi-nr-Mirchandanis-Career-Placements-India-Pvt-Ltd-Pondicherry-1-to-2-years-210318005949?src=jobsearchDesk&sid=15217229318605&xp=8&px=7,Business Analyst ( IT / Technology  )  - Cpi-nr,Business Analyst ( IT / Technology  )  - Cpi-nr,Mirchandanis Career Placements India Pvt. Ltd,Pondicherry,1-2 yrs,IT Business Analyst, ,200000 - 400000 P.A.,2018-03-21,1,2,200000,400000
https://www.naukri.com/job-listings-Senior-HR-Recruiter-IT-NON-IT-HR-Remedy-Pune-HR-Remedy-India-Pune-1-to-4-years-210318004967?src=jobsearchDesk&sid=15217229318605&xp=9&px=7,Senior HR Recruiter - IT & NON IT @ HR Remedy - Pune,Senior HR Recruiter - IT & NON IT @ HR Remedy - Pune,HR Remedy India,Pune,1-4 yrs,hr- recruitment- hiring- bulk hiring- volume hiring- volume recruitment..., ,175000 - 300000 P.A. Earn Incentives of 15000 to R...,2018-03-21,1,4,175000,300000
https://www.naukri.com/job-listings-IT-Services-Officer-SAP-PP-Manufacturing-mnc-pune-Vesat-Management-Consultants-Pvt-Ltd-Pune-5-to-8-years-210318004615?src=jobsearchDesk&sid=15217229318605&xp=10&px=7,IT  Services  Officer-- SAP  PP- Manufacturing-mnc-pune,IT  Services  Officer-- SAP  PP- Manufacturing-mnc-pune,Vesat Management Consultants Pvt. Ltd,Pune,5-8 yrs,Qm- SAP PP- PM- IT Services- Project Implementation, ,1000000 - 1300000 P.A.,2018-03-21,5,8,1000000,1300000
https://www.naukri.com/job-listings-Card-Systems-Specialist-IT-Applications-TEKINROADS-CONSULTING-LLP-Doha-Qatar-10-to-20-years-210318001140?src=jobsearchDesk&sid=15217229318605&xp=11&px=7,Card Systems Specialist - IT Applications,Card Systems Specialist - IT Applications,TEKINROADS CONSULTING LLP,Doha- Qatar,10-20 yrs,emv- atm- pos- project management- electronic cash registers integration- c..., ,Not disclosed,2018-03-21,10,20,0,0
https://www.naukri.com/job-listings-US-IT-Recruiter-Sr-US-IT-Recruiter-Lead-US-IT-Recruiter-BRAINS-N-SKILLS-Placement-Consultants-Bengaluru-3-to-7-years-210318000458?src=jobsearchDesk&sid=15217229318605&xp=12&px=7,US IT Recruiter/ Sr. US IT Recruiter/ Lead US IT Recruiter,US IT Recruiter/ Sr. US IT Recruiter/ Lead US IT Recruiter,BRAINS 'N' SKILLS Placement Consultants,Bengaluru,3-7 yrs,US IT Recruitment- US Market- Sr. US IT Recruiter- Lead US IT Recruiter..., ,350000 - 500000 P.A.,2018-03-21,3,7,350000,500000
https://www.naukri.com/job-listings-US-IT-Recruiter-Consultants-Delhi-NCR-2-to-7-years-210318000032?src=jobsearchDesk&sid=15217229318605&xp=13&px=7,US IT Recruiter,US IT Recruiter,Premium Job Consultants,Delhi NCR,2-7 yrs,US IT Recruitment- US IT Staffing, ,125000 - 500000 P.A.,2018-03-21,2,7,125000,500000
https://www.naukri.com/job-listings-US-IT-Recruiter-Bangalore-Traverze-Consultancy-Solutions-Pvt-Ltd-Bengaluru-Marathahalli-0-to-3-years-070318000566?src=jobsearchDesk&sid=15217229318605&xp=14&px=7,US IT Recruiter - Bangalore,US IT Recruiter - Bangalore,Traverze Consultancy Solutions Pvt Ltd.,Bengaluru(Marathahalli),0-3 yrs,US IT Recruitment- W2- Corp- Us Tax- dice- monster- career builder- indeed-..., ,Not disclosed,2018-03-21,0,3,0,0
https://www.naukri.com/job-listings-Inside-Sales-Executive-IT-Services-US-Market-Blue-Bird-Technologies-Pvt-Ltd-Bengaluru-2-to-4-years-011117001731?src=jobsearchDesk&sid=15217229318605&xp=15&px=7,Inside Sales Executive - IT Services (US Market),Inside Sales Executive - IT Services (US Market),Blue Bird Technologies Pvt. Ltd.,Bengaluru,2-4 yrs,inside sales- cold calling- us market- Business Development Executive- BDE, ,Not disclosed,2018-03-21,2,4,0,0
https://www.naukri.com/job-listings-IT-Analyst-Tab-Placements-Delhi-NCR-4-to-6-years-220318002203?src=jobsearchDesk&sid=15217229318605&xp=16&px=7,IT Analyst,IT Analyst,Tab Placements,Delhi NCR,4-6 yrs,System Development- Process Improvement, ,425000 - 500000 P.A.,2018-03-22,4,6,425000,500000
https://www.naukri.com/job-listings-Java-Developer-IT-Company-in-Chennai-BAYBALLS-HR-SERVICES-PRIVATE-LIMITED-Chennai-2-to-5-years-210318006897?src=jobsearchDesk&sid=15217229318605&xp=17&px=7,Java Developer - IT Company in Chennai,Java Developer - IT Company in Chennai,BAYBALLS HR SERVICES PRIVATE LIMITED,Chennai,2-5 yrs,Spring- Java- Javascript- Angularjs, ,200000 - 700000 P.A.,2018-03-21,2,5,200000,700000
https://www.naukri.com/job-listings-Angular-2-4-Developer-IT-Service-Based-Startup-Sector-62-Noida-Sunrise-Consultancy-Noida-2-to-5-years-210318004888?src=jobsearchDesk&sid=15217229318605&xp=18&px=7,Angular 2/4 Developer || IT Service Based Startup || Sector 62 Noida,Angular 2/4 Developer || IT Service Based Startup || Sector 62 Noida,Sunrise Job Consultancy,Noida,2-5 yrs,Javascript, ,100000 - 600000 P.A.,2018-03-21,2,5,100000,600000
https://www.naukri.com/job-listings-Wordpress-Developer-For-USA-Based-IT-Company-in-Mohali-salary-20-25k-Capital-Placement-Services-Chandigarh-Mohali-1-to-5-years-210318002692?src=jobsearchDesk&sid=15217229318605&xp=19&px=7,Wordpress Developer For USA Based IT Company in Mohalisalary-20-25k,Wordpress Developer For USA Based IT Company in Mohalisalary-20-25k,Capital Placement Services,Chandigarh- Mohali,1-5 yrs,wordpress- CakePHP- php- lamp- mysql- Mohali- chandigarh- panchkula- baddi-..., ,200000 - 300000 P.A.,2018-03-21,1,5,200000,300000
https://www.naukri.com/job-listings-Stock-Research-Executive-in-5-day-Working-Company-in-Spaze-IT-Park-Capital-Placement-Services-Delhi-NCR-Gurgaon-3-to-8-years-120218003038?src=jobsearchDesk&sid=15217229318605&xp=20&px=7,Stock Research Executive Job in 5 day Working Company in Spaze IT Park,Stock Research Executive Job in 5 day Working Company in Spaze IT Park,Capital Placement Services,Delhi NCR- Gurgaon,3-8 yrs,stock research- stock research analyst- stock equity analyst- stock broking..., ,400000 - 500000 P.A.,2018-03-21,3,8,400000,500000
https://www.naukri.com/job-listings-Internal-Auditor-female-hiring-in-MNC-IT-Hardware-Company-Rhodoks-Manpower-Services-Bengaluru-5-to-10-years-111217001315?src=jobsearchDesk&sid=15217229318605&xp=21&px=7,Internal Auditor (female)-hiring in MNC IT Hardware Company,Internal Auditor (female)-hiring in MNC IT Hardware Company,Rhodoks Manpower Services,Bengaluru,5-10 yrs,internal audit- auditor- internal auditor- lead auditor- audit executive..., ,Not disclosed,2018-03-21,5,10,0,0
https://www.naukri.com/job-listings-Front-Office-Executive-IT-Company-Shaleen-management-consultants-private-limited-Indore-1-to-2-years-041017001039?src=jobsearchDesk&sid=15217229318605&xp=22&px=7,Front Office Executive ( IT Company ),Front Office Executive ( IT Company ),Shaleen management consultants private limited,Indore,1-2 yrs,Phone- Internet- MS Office- Computer- Front Office, ,Not disclosed,2018-03-21,1,2,0,0
https://www.naukri.com/job-listings-Opportunities-for-Software-Engineers-MVC-Developers-in-US-Based-IT-Co-First-Insight-Software-Solutions-I-Pvt-Ltd-Pune-Pune-Nashik-Highway-3-to-8-years-070318009145?src=jobsearchDesk&sid=15217229318605&xp=23&px=7,Opportunities for Software Engineers- MVC Developers in US Based IT Co,Opportunities for Software Engineers- MVC Developers in US Based IT Co,First Insight Software Solutions (I) Pvt. Ltd.,Pune(Pune Nashik Highway),3-8 yrs,asp.net mvc- html- jquery- html5- oops- MVC Framework- MVC5- MVC4- MVC- MVC...,  Company Profile:   First Insight is a product based software development company ...,375000 - 875000 P.A.,2018-03-21,3,8,375000,875000
https://www.naukri.com/job-listings-Business-Development-Executive-US-IT-Staffing-Bench-Sales-BruteForce-Solutions-Inc-Delhi-NCR-Noida-3-to-8-years-300118000003?src=jobsearchDesk&sid=15217229318605&xp=24&px=7,Business Development Executive - US IT Staffing | Bench Sales,Business Development Executive - US IT Staffing | Bench Sales,BruteForce Solutions Inc,Delhi NCR- Noida,3-8 yrs,US IT Staffing- us it recruitment- us staffing- us recruitment- Bench Sales...,   Immediate Joining       A commitment to the quality/value of ...,Not disclosed,2018-03-20,3,8,0,0
https://www.naukri.com/job-listings-Manager-IT-Kirby-Building-Systems-India-Pvt-Ltd-Hyderabad-8-to-10-years-200318901687?src=jobsearchDesk&sid=15217229318605&xp=25&px=7,Manager - IT,Manager - IT,Kirby Building Systems India Pvt. Ltd.,Hyderabad,8-10 yrs,Networking- AutoCAD- IT Infrastructure- Service Desk- Hardware- IT Support-...,Reporting To:  Sr IT Manager-Business Solutions- KIRBY Kuwait   Job Summary: ...,Not disclosed,2018-03-20,8,10,0,0
https://www.naukri.com/job-listings-IT-Sales-Manager-Success-Metric-Private-Limited-Hyderabad-1-to-4-years-200318900245?src=jobsearchDesk&sid=15217229318605&xp=26&px=7,IT Sales Manager,IT Sales Manager,Success Metric Private Limited,Hyderabad,1-4 yrs,Sales Executive Activities- Sales Management- Selling- IT Sales..., Job Description   The role involves extensive travel across the city- state and country. ...,Not disclosed,2018-03-20,1,4,0,0
https://www.naukri.com/job-listings-Desktop-IT-Support-Engineer-ViaSat-India-Private-Limited-Chennai-5-to-7-years-200318900042?src=jobsearchDesk&sid=15217229318605&xp=27&px=7,Desktop/ IT Support Engineer,Desktop/ IT Support Engineer,ViaSat India Private Limited,Chennai,5-7 yrs,Networking- System Administration- GPO- IT Support- Active Directory- DNS..., ,Not disclosed,2018-03-20,5,7,0,0
https://www.naukri.com/job-listings-We-are-Hiring-Sr-Domestic-IT-Recruiter-Consulting-Background-Must-Avani-Tech-Solutions-Private-Limited-Hyderabad-3-to-6-years-200318008868?src=jobsearchDesk&sid=15217229318605&xp=28&px=7,We are Hiring Sr Domestic IT Recruiter | Consulting Background Must,We are Hiring Sr Domestic IT Recruiter | Consulting Background Must,Avani Tech Solutions Private Limited,Hyderabad,3-6 yrs,IT Recruitment- Hiring- Contract Hiring- Contract to Hire- C2H, ,300000 - 600000 P.A.,2018-03-20,3,6,300000,600000
https://www.naukri.com/job-listings-Urgent-Opening-for-IT-Sales-Manager-IT-Sales-Executive-BDE-BDM-Ranks-Digital-Media-Pvt-Ltd-Noida-Sector-63-Noida-2-to-4-years-200318008443?src=jobsearchDesk&sid=15217229318605&xp=29&px=7,Urgent Opening for IT Sales Manager IT Sales Executive BDE BDM,Urgent Opening for IT Sales Manager IT Sales Executive BDE BDM,Ranks Digital Media Pvt. Ltd.,Noida(Sector-63 Noida),2-4 yrs,Sales Management- Digital Marketing- Guru- Elance- Bde- Bdm...,Ranks Digital Media is looking for End to End Sales Professional who have good experience in selling IT ...,125000 - 500000 P.A.,2018-03-20,2,4,125000,500000
https://www.naukri.com/job-listings-Security-Testing-IT-MNC-Kolkata-AERONUBE-TECHNOLOGY-PRIVATE-LIMITED-Kolkata-3-to-7-years-200318006671?src=jobsearchDesk&sid=15217229318605&xp=30&px=7,Security Testing | IT MNC | Kolkata,Security Testing | IT MNC | Kolkata,AERONUBE TECHNOLOGY PRIVATE LIMITED,Kolkata,3-7 yrs,Vulnerability- Threat Management- Fortify- AppScan Burp Suite...,Greetings from  Aeronube Technology !!   This is with regards to an excellent opportunity ...,Not disclosed,2018-03-20,3,7,0,0
https://www.naukri.com/job-listings-Hiring-for-Brazilian-Portuguese-Language-Expert-in-Pune-for-IT-Company-TUDIP-TECHNOLOGIES-PRIVATE-LIMITED-Pune-0-to-5-years-200318006330?src=jobsearchDesk&sid=15217229318605&xp=31&px=7,Hiring for Brazilian Portuguese Language Expert in Pune for IT Company,Hiring for Brazilian Portuguese Language Expert in Pune for IT Company,TUDIP TECHNOLOGIES PRIVATE LIMITED,Pune,0-5 yrs,Portuguese Language Expert- Brazil- Portuguese- Brazilian- Translation,Tudip Technologies Pvt. Ltd.- looking for passionate Brazilian Portuguese Language Expert who to be part ...,100000 - 600000 P.A.,2018-03-20,0,5,100000,600000
https://www.naukri.com/job-listings-HR-Admin-Executive-at-Delhi-Head-Office-of-Reputed-IT-Company-Eagle-Information-System-Pvt-Ltd-Delhi-NCR-2-to-6-years-200318006304?src=jobsearchDesk&sid=15217229318605&xp=32&px=7,HR & Admin Executive at Delhi Head Office of Reputed IT Company,HR & Admin Executive at Delhi Head Office of Reputed IT Company,Eagle Information System Pvt. Ltd.,Delhi NCR,2-6 yrs,hr administration- office executive- hr executive- vendor management..., This vacancy is at the company Head Office at Nehru Place- New Delhi location.  ...,250000 - 425000 P.A.,2018-03-20,2,6,250000,425000
https://www.naukri.com/job-listings-IT-Infrastructure-Lead-MINFY-TECHNOLOGIES-PRIVATE-LIMITED-Hyderabad-10-to-20-years-200318005907?src=jobsearchDesk&sid=15217229318605&xp=33&px=7,IT Infrastructure Lead,IT Infrastructure Lead,MINFY TECHNOLOGIES PRIVATE LIMITED,Hyderabad,10-20 yrs,data center management- windows- aws- it infrastructure- cloud storage..., Hi  All-  Greetings from TechMinfy-    We are Hiring for Infrastructure Lead ...,1300000 - 1900000 P.A.,2018-03-20,10,20,1300000,1900000
https://www.naukri.com/job-listings-Oracle-DB-IT-MNC-Navi-Mumbai-AERONUBE-TECHNOLOGY-PRIVATE-LIMITED-Navi-Mumbai-3-to-5-years-200318005289?src=jobsearchDesk&sid=15217229318605&xp=34&px=7,Oracle DB | IT MNC | Navi Mumbai,Oracle DB | IT MNC | Navi Mumbai,AERONUBE TECHNOLOGY PRIVATE LIMITED,Navi Mumbai,3-5 yrs,Oracle- Elastic Search- My SQL,Greetings from  Aeronube Technology !!   This is with regards to an excellent opportunity ...,Not disclosed,2018-03-20,3,5,0,0
https://www.naukri.com/job-listings-Test-Engineer-IT-MNC-Navi-Mumbai-AERONUBE-TECHNOLOGY-PRIVATE-LIMITED-Navi-Mumbai-2-to-4-years-200318004549?src=jobsearchDesk&sid=15217229318605&xp=35&px=7,Test Engineer | IT MNC | Navi Mumbai,Test Engineer | IT MNC | Navi Mumbai,AERONUBE TECHNOLOGY PRIVATE LIMITED,Navi Mumbai,2-4 yrs,IMS- VoWifi Testing- eMBMS technologies- LTE UE Protocol Testing,Greetings from  Aeronube Technology !!   This is with regards to an excellent opportunity ...,Not disclosed,2018-03-20,2,4,0,0
https://www.naukri.com/job-listings-IT-Support-Executive-Global-Management-Consulting-Company-Pune-Kaizen-Institute-India-Pvt-Ltd-Pune-NIBM-3-to-5-years-200318004126?src=jobsearchDesk&sid=15217229318605&xp=36&px=7,IT Support Executive - Global Management Consulting Company Pune,IT Support Executive - Global Management Consulting Company Pune,Kaizen Institute India Pvt. Ltd.,Pune(NIBM),3-5 yrs,Networking- IT Support- Network Support,Development of Kaizen Institute's IT systems including website- intranet- LMS 	User helpdesk support ...,Not disclosed,2018-03-20,3,5,0,0
https://www.naukri.com/job-listings-Key-Account-Manager-IT-Sales-5-12yrs-UNIWARE-SYSTEMS-PVT-LTD-Chennai-5-to-10-years-200318003795?src=jobsearchDesk&sid=15217229318605&xp=37&px=7,Key Account Manager - IT Sales (5-12yrs),Key Account Manager - IT Sales (5-12yrs),UNIWARE SYSTEMS PVT LTD,Chennai,5-10 yrs,new business- it infrastructure- cloud sales- aws- emc storage- server...,  Responsible for IT infrastructure sales - Server- Storage and Cloud products  Conduct ...,Not disclosed,2018-03-20,5,10,0,0
https://www.naukri.com/job-listings-Hiring-for-US-IT-Recruiter-Sr-Recruiter-Gemini-Consulting-Services-India-Pvt-Ltd-Hyderabad-Banjara-hills-3-to-7-years-200318002542?src=jobsearchDesk&sid=15217229318605&xp=38&px=7,Hiring for US IT Recruiter / Sr Recruiter,Hiring for US IT Recruiter / Sr Recruiter,Gemini Consulting & Services India Pvt Ltd,Hyderabad(Banjara hills),3-7 yrs,us it recruitment- w2- c2c- dice- h1b- screening- ats- staffing- hiring- us...,Dear Candidate .. We are hiring US IT Recruiter for our company - below is the JD ..  Exp : ...,Not disclosed,2018-03-20,3,7,0,0
https://www.naukri.com/job-listings-Product-Manager-IT-Noida-Ishwar-Raj-Solutions-Noida-5-to-10-years-200318002111?src=jobsearchDesk&sid=15217229318605&xp=39&px=7,Product Manager- IT- Noida,Product Manager- IT- Noida,Ishwar Raj Solutions,Noida,5-10 yrs,IT Management- Product Management,Dear Candidate-  We have some urgent opening for  Product Manager- IT  for  Noida ...,900000 - 1800000 P.A. Best in the industry,2018-03-20,5,10,900000,1800000
https://www.naukri.com/job-listings-Sr-Consultant-Team-Lead-recruitments-Non-IT-noida-Spectrum-Talent-Management-Noida-Sector-63-Noida-3-to-7-years-200318001770?src=jobsearchDesk&sid=15217229318605&xp=40&px=7,Sr. Consultant/ Team Lead (recruitments)- Non IT (noida),Sr. Consultant/ Team Lead (recruitments)- Non IT (noida),Spectrum Talent Management,Noida(Sector-63 Noida),3-7 yrs,non it recruitment- pharma- ecommerce- non it- automobile- manufacturing..., Job Role -Sr. Consultant/ Team Lead (Recruitments)- Non IT (Location Noida Sector 63 ...,Not disclosed,2018-03-20,3,7,0,0
https://www.naukri.com/job-listings-Business-Analyst-IT-MNC-Mumbai-AERONUBE-TECHNOLOGY-PRIVATE-LIMITED-Mumbai-3-to-4-years-200318000974?src=jobsearchDesk&sid=15217229318605&xp=41&px=7,Business Analyst | IT MNC | Mumbai,Business Analyst | IT MNC | Mumbai,AERONUBE TECHNOLOGY PRIVATE LIMITED,Mumbai,3-4 yrs,Business Analyst- Requirement Gathering,Greetings from  Aeronube Technology !!   This is with regards to an excellent opportunity ...,Not disclosed,2018-03-20,3,4,0,0
https://www.naukri.com/job-listings-IT-Manager-INSTYLE-MOTEL-SERVICES-PVT-LTD-AIRORT-RESIDENCY-HOTEL-Delhi-NCR-Samalkha-1-to-3-years-200318000526?src=jobsearchDesk&sid=15217229318605&xp=42&px=7,IT Manager,IT Manager,INSTYLE MOTEL SERVICES PVT LTD ( AIRORT RESIDENCY HOTEL ),Delhi NCR(Samalkha),1-3 yrs,EPABX- Computer Hardware- CCTV System- IT Management,  Hardware ( Computer and Printer )  Router  Switch ( Internet ...,200000 - 250000 P.A.,2018-03-20,1,3,200000,250000
https://www.naukri.com/job-listings-IT-Recruiter-sr-IT-Recruiter-US-Staffing-Helm-Analytics-Pvt-Ltd-Noida-Sector-16-Noida-2-to-7-years-200318000226?src=jobsearchDesk&sid=15217229318605&xp=43&px=7,IT Recruiter/sr. IT Recruiter- US Staffing,IT Recruiter/sr. IT Recruiter- US Staffing,Helm Analytics Pvt Ltd,Noida(Sector-16 Noida),2-7 yrs,IT Recruitment- US IT Staffing- Screening- Interviewing- US Market...,We have an urgent position of IT Recruiter/Sr.IT Recruiter for US market.  Daily Job ...,600000 - 750000 P.A.,2018-03-20,2,7,600000,750000
https://www.naukri.com/job-listings-IT-Manager-Nisith-Keshari-Constructions-Private-Limited-Ranchi-Jharkhand-1-to-5-years-200318000137?src=jobsearchDesk&sid=15217229318605&xp=44&px=7,IT Manager,IT Manager,Nisith Keshari Constructions Private Limited,Ranchi- Jharkhand,1-5 yrs,Networking- IT Management- Information Security- Data Network...,*Install & configure computer hardware operating systems & applications *Monitor & ...,Not disclosed,2018-03-20,1,5,0,0
https://www.naukri.com/job-listings-US-IT-Recruiter-Business-Development-Manager-Account-Manager-Fluxtek-Solutions-Hyderabad-0-to-5-years-200318000084?src=jobsearchDesk&sid=15217229318605&xp=45&px=7,US IT Recruiter Business Development Manager Account Manager,US IT Recruiter Business Development Manager Account Manager,Fluxtek Solutions,Hyderabad,0-5 yrs,us it recruitment- c2c- w2- shortlisting- linkedin- ats- account management...,PSC Infotech Pvt Ltd- a renowned US IT staffing augmentation Company (www.pscinfotech.com) is growing ...,Not disclosed,2018-03-20,0,5,0,0
https://www.naukri.com/job-listings-IT-Bench-Sales-MSoft-Solutions-Pvt-Ltd-Hyderabad-2-to-5-years-190318008698?src=jobsearchDesk&sid=15217229318605&xp=46&px=7,IT Bench Sales,IT Bench Sales,MSoft Solutions Pvt Ltd,Hyderabad,2-5 yrs,IT Sales Recruiter- IT Sales- IT Marketing- Bench Sales- bench marketing..., 1. Responsible for handling IT requirements from US based clients.  2. Responsible for ...,Not disclosed,2018-03-20,2,5,0,0
https://www.naukri.com/job-listings-Sr-it-Recruiter-Ojas-Innovative-Technologies-Private-Limited-Hyderabad-2-to-5-years-210318001832?src=jobsearchDesk&sid=15217229318605&xp=47&px=7,Sr.it Recruiter,Sr.it Recruiter,Ojas Innovative Technologies Private Limited,Hyderabad,2-5 yrs,IT Recruiter,IT Recruiter ...,100000 - 400000 P.A.,2018-03-21,2,5,100000,400000
https://www.naukri.com/job-listings-US-IT-Recruiter-Udaipur-Location-Shaleen-management-consultants-private-limited-Udaipur-0-to-1-years-121017002064?src=jobsearchDesk&sid=15217229318605&xp=48&px=7,US IT Recruiter | Udaipur Location,US IT Recruiter | Udaipur Location,Shaleen management consultants private limited,Udaipur,0-1 yrs,US IT Recruitment- Communication Skills- Night shift- us process..., ,Not disclosed,2018-03-21,0,1,0,0
https://www.naukri.com/job-listings-Urgent-Opening-PHP-Developer-For-IT-Industry-At-Cuttack-Middle-Range-Services-Private-Limited-Cuttack-2-to-4-years-210318006396?src=jobsearchDesk&sid=15217229318605&xp=49&px=7,Urgent Opening PHP Developer For IT Industry At Cuttack,Urgent Opening PHP Developer For IT Industry At Cuttack,Middle Range Services Private Limited,Cuttack,2-4 yrs,PHP- Wordpress- Codeigniter- Yii- Joomla, ,400000 - 425000 P.A.,2018-03-21,2,4,400000,425000
https://www.naukri.com/job-listings-Hiring-for-IT-Recruiter-for-Hyderabad-Location-Gemini-Consulting-Services-India-Pvt-Ltd-Hyderabad-Banjara-hills-1-to-3-years-200318004115?src=jobsearchDesk&sid=15217229318605&xp=50&px=7,Hiring for IT Recruiter for Hyderabad Location,Hiring for IT Recruiter for Hyderabad Location,Gemini Consulting & Services India Pvt Ltd,Hyderabad(Banjara hills),1-3 yrs,screening- staffing- hiring- corp to corp,Greetings!!!  This is Sindura from Gemini Consulting & Services (SAP & IT Practice)- We ...,80000 - 275000 P.A. Best In Industry,2018-03-20,1,3,80000,275000
https://www.naukri.com/job-listings-IT-Helpdesk-Engineer-Oceaneering-International-Services-Limited-Chandigarh-0-to-2-years-210318001358?src=jobsearchDesk&sid=15217229347431&xp=1&px=8,IT Helpdesk Engineer,IT Helpdesk Engineer,Oceaneering International Services Limited,Chandigarh,0-2 yrs,IT Helpdesk- Communication Skills, ,Not disclosed,2018-03-21,0,2,0,0
https://www.naukri.com/job-listings-Opening-for-IT-Help-Desk-1-5years-Accenture-Solutions-Pvt-Ltd-Hyderabad-4-to-8-years-070218008484?src=jobsearchDesk&sid=15217229347431&xp=2&px=8,Opening for IT Help Desk (1 - 5years) ,Opening for IT Help Desk (1 - 5years) ,Accenture Solutions Pvt Ltd,Hyderabad,4-8 yrs,Networking- A+- CCNA- MCP- IT Helpdesk- System Troubleshooting..., ,Not disclosed,2018-03-22,4,8,0,0
https://www.naukri.com/job-listings-Head-Trainer-It-electronic-Courses-cloud-hacking-Sansach-Group-of-Companies-CADD-Centre-Mumbai-Khadakpada-6-Thane-4-to-9-years-200318008799?src=jobsearchDesk&sid=15217229347431&xp=3&px=8,Head Trainer - It/electronic Courses (cloudhacking),Head Trainer - It/electronic Courses (cloudhacking),Sansach Group of Companies - CADD Centre,Mumbai(Khadakpada+6)- Thane,4-9 yrs,training- Certified Ethical Hacker- Ethical Hacking- Cloud Computing- MySQL...,,300000 - 800000 P.A. Discussed in Interview round,2018-03-20,4,9,300000,800000
https://www.naukri.com/job-listings-IT-Lead-QA-Engineer-6months-Contractual-Role-ELS-International-Education-Pathways-Pvt-Ltd-Chennai-Mylapore-5-to-10-years-091217001977?src=jobsearchDesk&sid=15217229347431&xp=4&px=8,IT Lead QA Engineer (6months Contractual Role),IT Lead QA Engineer (6months Contractual Role),ELS International Education Pathways Pvt Ltd,Chennai(Mylapore),5-10 yrs,team management- application tester- qa lead- quality assurance lead,   ELS is looking to expand our IT Development team by adding a Lead QA Engineer. The ...,Not disclosed,2018-03-21,5,10,0,0
https://www.naukri.com/job-listings-Urgent-Opening-for-HR-Admin-Manager-for-It-ites-Company-in-Jaipur-Soncoya-Solutions-Private-Limited-Jaipur-5-to-10-years-210318004811?src=jobsearchDesk&sid=15217229347431&xp=5&px=8,Urgent Opening for HR Cum Admin Manager  for It/ites Company in Jaipur,Urgent Opening for HR Cum Admin Manager  for It/ites Company in Jaipur,Soncoya Solutions Private Limited,Jaipur,5-10 yrs,recruitment- hr administration- compensation- payroll- pms- labour laws...,Review and align the HR policies with corporate objectives. Plan and chart out the Organizational ...,475000 - 700000 P.A.,2018-03-21,5,10,475000,700000
https://www.naukri.com/job-listings-Work-With-World-Leader-it-Recruiter-sr-IT-Recruiter-bangalore-Pune-Allegis-Services-India-Pvt-Ltd-Bengaluru-Pune-0-to-1-years-080318001629?src=jobsearchDesk&sid=15217229347431&xp=6&px=8,Work With World Leader_it Recruiter/sr. IT Recruiter_bangalore & Pune,Work With World Leader_it Recruiter/sr. IT Recruiter_bangalore & Pune,Allegis Services India Pvt. Ltd.,Bengaluru- Pune,0-1 yrs,IT Recruitment- technical recruitment- technical hiring..., ,275000 - 400000 P.A. Uncapped Incentives + Medical ...,2018-03-20,0,1,275000,400000
https://www.naukri.com/job-listings-HR-Recruiter-IT-NOT-IT-WALK-IN-Aundh-Wakad-Genesis-HR-Services-Pune-0-to-3-years-260118000557?src=jobsearchDesk&sid=15217229347431&xp=7&px=8,HR Recruiter IT & NOT IT @ WALK IN !! Aundh / Wakad ,HR Recruiter IT & NOT IT @ WALK IN !! Aundh / Wakad ,Genesis HR Services,Pune,0-3 yrs,HR- Recruitment- Remedy- Yellow box- IT- HR Recruiter- IT Recruiter..., ,50000 - 275000 P.A. Incentive,2018-03-22,0,3,50000,275000
