https://www.naukri.com/job-listings-IT-Cyber-Security-Architect-Khoj-Naukri-Services-OPC-Pvt-Ltd-Chennai-8-to-12-years-200318005411?src=jobsearchDesk&sid=152172294625&xp=14&px=11,IT- Cyber Security Architect,IT- Cyber Security Architect,Khoj Naukri Services (OPC) Pvt Ltd,Chennai,8-12 yrs,Cyber Security- Cyber Security Analyst, ,1200000 - 2000000 P.A.,2018-03-20,8,12,1200000,2000000
https://www.naukri.com/job-listings-Officer-IT-WIZSPRINT-CONSULTANTS-OPC-PRIVATE-LIMITED-Lucknow-3-to-8-years-200318000684?src=jobsearchDesk&sid=152172294625&xp=15&px=11,Officer - IT,Officer - IT,WIZSPRINT CONSULTANTS (OPC) PRIVATE LIMITED,Lucknow,3-8 yrs,LSMW- Bdc- PCR- Time Quota- Holiday Calendar- SAP- ABAP- Payroll, ,275000 - 600000 P.A.,2018-03-20,3,8,275000,600000
https://www.naukri.com/job-listings-Institute-Head-Faridabad-IT-Institute-Mcube-placements-Faridabad-1-to-6-years-120218003451?src=jobsearchDesk&sid=152172294625&xp=16&px=11,Institute Head/ Faridabad/ IT Institute,Institute Head/ Faridabad/ IT Institute,Mcube placements,Faridabad,1-6 yrs,sales- planning- institutional manager- institutional head..., ,100000 - 250000 P.A.,2018-03-20,1,6,100000,250000
https://www.naukri.com/job-listings-Lead-Magento-Developer-Noida-An-US-IT-Web-App-Company-Ablehunt-Consulting-Delhi-NCR-Noida-4-to-9-years-120118007067?src=jobsearchDesk&sid=152172294625&xp=17&px=11,Lead Magento Developer- Noida [ An US IT & Web App Company,Lead Magento Developer- Noida [ An US IT & Web App Company,Ablehunt Consulting,Delhi NCR- Noida,4-9 yrs,mysql- magento- jenkins- git hub- svn- magento lead- magento certified..., ,500000 - 1200000 P.A.,2018-03-20,4,9,500000,1200000
https://www.naukri.com/job-listings-IT-Service-Officer-sap-Fico-Manufacturing-mnc-pune-Vesat-Management-Consultants-Pvt-Ltd-Pune-5-to-8-years-210318004530?src=jobsearchDesk&sid=152172294625&xp=18&px=11,IT Service Officer-sap Fico- Manufacturing-mnc-pune,IT Service Officer-sap Fico- Manufacturing-mnc-pune,Vesat Management Consultants Pvt. Ltd,Pune,5-8 yrs,SAP FICO- Product Costing, ,1000000 - 1200000 P.A.,2018-03-21,5,8,1000000,1200000
https://www.naukri.com/job-listings-IT-Freshers-Batch-Take-Wings-Bengaluru-Chennai-Hyderabad-0-to-5-years-210318002075?src=jobsearchDesk&sid=152172294625&xp=19&px=11,IT Freshers -  Batch,IT Freshers -  Batch,Take Wings,Bengaluru- Chennai- Hyderabad,0-5 yrs,C C++- Trainee- Diploma- Fresher- Asp.net- Sql Programming..., ,Not disclosed,2018-03-21,0,5,0,0
https://www.naukri.com/job-listings-Sales-Business-Development-Executive-mumbai-IT-Sales-MARS-Placements-Services-Mumbai-0-to-1-years-090617001958?src=jobsearchDesk&sid=152172294625&xp=20&px=11,Sales / Business Development Executive-mumbai (IT Sales),Sales / Business Development Executive-mumbai (IT Sales),MARS Placements Services,Mumbai,0-1 yrs,Business Development- Sales- Cold Calling- Prospecting- B2B- Cxo, ,Not disclosed,2018-03-21,0,1,0,0
https://www.naukri.com/job-listings-Opening-for-Business-Development-IT-Sales-B2B-Corporate-Stellar-Information-Technology-Private-Limited-Mumbai-1-to-4-years-260218001215?src=jobsearchDesk&sid=152172294625&xp=21&px=11,Opening for Business Development - IT Sales B2B Corporate,Opening for Business Development - IT Sales B2B Corporate,Stellar Information Technology Private Limited,Mumbai,1-4 yrs,business development- it sales- b2b- Corporate Sales- Direct Sales- Service...,Business development   1.1. Generating prospects- meeting them and business development for data ...,200000 - 400000 P.A.,2018-03-19,1,4,200000,400000
https://www.naukri.com/job-listings-Hiring-for-Service-Desk-IT-Help-Desk-tech-Support-fresher-Diebold-Nixdorf-India-Private-Limited-Hyderabad-0-to-5-years-190318007987?src=jobsearchDesk&sid=152172294625&xp=22&px=11,Hiring for Service Desk/ IT Help Desk/tech Support/fresher,Hiring for Service Desk/ IT Help Desk/tech Support/fresher,Diebold Nixdorf India Private Limited,Hyderabad,0-5 yrs,Service Desk- IT Helpdesk- technical helpdesk- Technical Support..., ,Not disclosed,2018-03-19,0,5,0,0
https://www.naukri.com/job-listings-Team-Lead-recruitments-E-commerce-and-IT-Product-Hiring-noida-Spectrum-Talent-Management-Noida-Sector-63-Noida-3-to-8-years-190318007038?src=jobsearchDesk&sid=152172294625&xp=23&px=11,Team Lead(recruitments)- E-commerce and IT Product Hiring (noida),Team Lead(recruitments)- E-commerce and IT Product Hiring (noida),Spectrum Talent Management,Noida(Sector-63 Noida),3-8 yrs,ecommerce- non it- recruitment- e - commerce- ecom- recruiter- hiring- head...,   Job Role (Team Manager(Recruitments)-IT Product- E-Commerce Vertical ...,Not disclosed,2018-03-19,3,8,0,0
https://www.naukri.com/job-listings-Recruitments-IT-Spectrum-Talent-Management-Noida-1-to-5-years-190318006041?src=jobsearchDesk&sid=152172294625&xp=24&px=11,Recruitments IT,Recruitments IT,Spectrum Talent Management,Noida,1-5 yrs,IT Recruitment- IT Recruiter- technical recruiter,     Hi All-  We are hiring for  IT  Position for our own ...,100000 - 425000 P.A.,2018-03-19,1,5,100000,425000
https://www.naukri.com/job-listings-Wall-in-for-Freshers-US-IT-Staffing-0-2-yrs-Equinox-Consulting-Pvt-Ltd-Hyderabad-Malakpet-0-to-2-years-190318005117?src=jobsearchDesk&sid=152172294625&xp=25&px=11,Wall-in for Freshers- US IT Staffing (0-2 yrs) ,Wall-in for Freshers- US IT Staffing (0-2 yrs) ,Equinox Consulting (Pvt) Ltd,Hyderabad(Malakpet),0-2 yrs,fresher- b tech fresher- mba fresher- mca fresher- be fresher...,Job Description:  Designation                  : US IT Recruiter / Sourcing Specialist ( US Staffing ...,100000 - 350000 P.A.,2018-03-19,0,2,100000,350000
https://www.naukri.com/job-listings-IT-Executive-LEMON-TREE-HOTELS-LIMITED-Dehradun-Srinagar-1-to-2-years-190318004117?src=jobsearchDesk&sid=152172294625&xp=26&px=11,IT Executive,IT Executive,LEMON TREE HOTELS LIMITED,Dehradun- Srinagar,1-2 yrs,Front Office- Back Office- System Support- Access Control System...,The areas of responsibility include the following:   	Monitoring system use and security. ...,175000 - 200000 P.A.,2018-03-19,1,2,175000,200000
https://www.naukri.com/job-listings-IT-Head-Chennai-Consul-Neowatt-Power-Solutions-Pvt-ltd-Chennai-10-to-15-years-190318001910?src=jobsearchDesk&sid=152172294625&xp=27&px=11,IT Head - Chennai,IT Head - Chennai,Consul Neowatt Power Solutions Pvt. ltd.,Chennai,10-15 yrs,IT Head- information technology head- Information Technology Management...,    Job Location : Chennai     Job Description : ...,Not disclosed,2018-03-19,10,15,0,0
https://www.naukri.com/job-listings-US-IT-Recruiter-Sr-Recruiter-US-Night-Shifts-Only-Orgspire-Info-Technologies-private-Limited-Bengaluru-3-to-8-years-170318005906?src=jobsearchDesk&sid=152172294625&xp=28&px=11,US IT Recruiter / Sr Recruiter ( US Night Shifts Only ),US IT Recruiter / Sr Recruiter ( US Night Shifts Only ),Orgspire Info Technologies private Limited,Bengaluru,3-8 yrs,W2- H1B- Vendor Management- Negotiation Skills- US Recruiting...,,Not disclosed,2018-03-17,3,8,0,0
https://www.naukri.com/job-listings-Hiring-for-Service-Desk-IT-Help-Desk-tech-Support-fresher-Diebold-Nixdorf-India-Private-Limited-Hyderabad-0-to-5-years-170318002878?src=jobsearchDesk&sid=152172294625&xp=29&px=11,Hiring for Service Desk/ IT Help Desk/tech Support/fresher,Hiring for Service Desk/ IT Help Desk/tech Support/fresher,Diebold Nixdorf India Private Limited,Hyderabad,0-5 yrs,Service Desk- IT Helpdesk- technical helpdesk- Technical Support..., ,Not disclosed,2018-03-17,0,5,0,0
https://www.naukri.com/job-listings-Hiring-for-IT-Service-Desk-Tech-Mahindra-Bangalore-March-Tech-Mahindra-Ltd-Bengaluru-Whitefield-1-1-to-4-years-170318001976?src=jobsearchDesk&sid=152172294625&xp=30&px=11,Hiring for IT Service Desk  @ Tech Mahindra Bangalore March,Hiring for IT Service Desk  @ Tech Mahindra Bangalore March,Tech Mahindra Ltd,Bengaluru(Whitefield+1),1-4 yrs,Technical Support- International Voice Process- Service Desk- L1- Helpdesk-..., Dear Aspirants-     Greetings from Tech Mahindra!!!!		  We are hiring for ...,Not disclosed,2018-03-17,1,4,0,0
https://www.naukri.com/job-listings-Hiring-for-IT-Service-Desk-Tech-Mahindra-Bangalore-Tech-Mahindra-Ltd-Bengaluru-Whitefield-1-1-to-4-years-170318001969?src=jobsearchDesk&sid=152172294625&xp=31&px=11,Hiring for IT Service Desk  @ Tech Mahindra Bangalore,Hiring for IT Service Desk  @ Tech Mahindra Bangalore,Tech Mahindra Ltd,Bengaluru(Whitefield+1),1-4 yrs,Technical Support- International Voice Process- Service Desk- L1- Helpdesk-..., Dear Aspirants-     Greetings from Tech Mahindra!!!!		  We are hiring for ...,Not disclosed,2018-03-19,1,4,0,0
https://www.naukri.com/job-listings-US-IT-Technical-Recruiter-Cogent-Data-Solutions-LLC-Hyderabad-1-to-3-years-170318000581?src=jobsearchDesk&sid=152172294625&xp=32&px=11,US IT Technical Recruiter,US IT Technical Recruiter,Cogent Data Solutions LLC,Hyderabad,1-3 yrs,Technical Recruitment- W2- Dice- US Recruitment- Sourcing- Interviewing...,Job Description  Looking for immediate joiners- who can join us with in a week.  Role & ...,Not disclosed,2018-03-17,1,3,0,0
https://www.naukri.com/job-listings-Sourcing-Specialist-US-IT-Recruitment-PruTech-Solutions-India-Pvt-Ltd-Hyderabad-1-to-3-years-170118008841?src=jobsearchDesk&sid=152172294625&xp=33&px=11,Sourcing Specialist (US IT Recruitment),Sourcing Specialist (US IT Recruitment),PruTech Solutions India Pvt Ltd,Hyderabad,1-3 yrs,us it recruitment- w2- us staffing- dice- technical recruitment- screening-...,  Source candidate resumes on job boards for a wide range of corporate positions- including ...,Not disclosed,2018-03-16,1,3,0,0
https://www.naukri.com/job-listings-It-software-Engineer-Triveniethnics-com-Startup-Surat-2-to-4-years-160318901301?src=jobsearchDesk&sid=152172294625&xp=34&px=11,It/software Engineer,It/software Engineer,Triveniethnics.com-Startup,Surat,2-4 yrs,MySQL- PHP- Magento- SugarCRM- Web Technologies- Software Engineering..., JOB PROFILE:   1.	Maintain and manage the company's IT systems- including desktops- ...,Not disclosed,2018-03-20,2,4,0,0
https://www.naukri.com/job-listings-US-IT-Technical-Recruiter-Software-Technology-Inc-Hyderabad-2-to-7-years-160318008682?src=jobsearchDesk&sid=152172294625&xp=35&px=11,US IT Technical Recruiter,US IT Technical Recruiter,Software Technology Inc.,Hyderabad,2-7 yrs,technical recruitment- dice- w2- h1b- sourcing- linkedin- hiring...,  No.of Positions: 20      Hands on experience in end to end ...,Not disclosed,2018-03-16,2,7,0,0
https://www.naukri.com/job-listings-Walk-in-for-Service-Desk-IT-Help-desk-Diebold-Nixdorf-India-Private-Limited-Hyderabad-1-to-5-years-160318008195?src=jobsearchDesk&sid=152172294625&xp=36&px=11,Walk in for Service Desk/ IT Help desk,Walk in for Service Desk/ IT Help desk,Diebold Nixdorf India Private Limited,Hyderabad,1-5 yrs,service desk- it helpdesk- technical helpdesk- technical support..., ,Not disclosed,2018-03-16,1,5,0,0
https://www.naukri.com/job-listings-Hiring-Sr-BDE-IT-Sales-for-Futurism-Technologies-CMMI-3-Pune-FUTURISM-TECHNOLOGIES-PVT-LTD-Pune-3-to-7-years-160318006516?src=jobsearchDesk&sid=152172294625&xp=37&px=11,Hiring Sr BDE IT Sales for Futurism Technologies CMMI 3 Pune,Hiring Sr BDE IT Sales for Futurism Technologies CMMI 3 Pune,FUTURISM TECHNOLOGIES PVT LTD,Pune,3-7 yrs,business development- it sales- lead generation- cold calling...,Futurism Technologies- a leading Multinational Information Technology Solutions and Service Company ...,Not disclosed,2018-03-16,3,7,0,0
https://www.naukri.com/job-listings-Senior-IT-Recruiter-domestic-Market-Veritis-Solutions-India-Pvt-Ltd-Hyderabad-3-to-5-years-160318005729?src=jobsearchDesk&sid=152172294625&xp=38&px=11,Senior IT Recruiter (domestic Market),Senior IT Recruiter (domestic Market),Veritis Solutions India Pvt. Ltd.,Hyderabad,3-5 yrs,it recruitment- Technical Recruiter- IT Recruiter- Recruiter- HR Recruiter,Involved in end to end recruitment life cycle both in Contract and Permanent Staffing. Minimum 4 ...,250000 - 600000 P.A.,2018-03-16,3,5,250000,600000
https://www.naukri.com/job-listings-US-IT-Recruiter-PruTech-Solutions-India-Pvt-Ltd-Hyderabad-4-to-8-years-160318004529?src=jobsearchDesk&sid=152172294625&xp=39&px=11,US IT Recruiter,US IT Recruiter,PruTech Solutions India Pvt Ltd,Hyderabad,4-8 yrs,US IT Technical Recruiter,We at PruTech Looking for a recruiters who worked mostly on W2 (Green card & Citizens)- Sound ...,Not disclosed,2018-03-16,4,8,0,0
https://www.naukri.com/job-listings-IT-Recruiter-Malaysia-Aptude-Software-Solutions-India-Pvt-Ltd-Hyderabad-Kothaguda-1-to-6-years-160318003995?src=jobsearchDesk&sid=152172294625&xp=40&px=11,IT Recruiter- Malaysia,IT Recruiter- Malaysia,Aptude Software Solutions India Pvt. Ltd.,Hyderabad(Kothaguda),1-6 yrs,IT Recruitment- it staffing- information technology staffing...,Key responsibilities :   	Confident recruiter for APAC majorly for (Singapore/ Malaysia/ ...,Not disclosed,2018-03-16,1,6,0,0
https://www.naukri.com/job-listings-Sales-Executive-Area-Sales-Manager-Opening-in-Growing-IT-Company-VK-SOFT-Pvt-Ltd-Lucknow-Varanasi-Agra-0-to-5-years-160318003235?src=jobsearchDesk&sid=152172294625&xp=41&px=11,Sales Executive Area Sales Manager - Opening in Growing IT Company,Sales Executive Area Sales Manager - Opening in Growing IT Company,VK SOFT Pvt. Ltd.,Lucknow- Varanasi- Agra,0-5 yrs,area sales management- sales executive activities- selling...,We are looking for a competitive and reliable Sales Executive to help us develop our business activities. ...,70000 - 250000 P.A. Incentives TA Other Expanses,2018-03-16,0,5,70000,250000
https://www.naukri.com/job-listings-Mid-Senior-US-IT-Work-From-Home-0315-Canbay-Softech-Private-Limited-Chennai-Vadodara-Indore-3-to-8-years-150318009697?src=jobsearchDesk&sid=152172294625&xp=42&px=11,Mid / Senior US IT Recruiters: - Work From Home 0315,Mid / Senior US IT Recruiters: - Work From Home 0315,Canbay Softech Private Limited,Chennai- Vadodara- Indore,3-8 yrs,us staffing- IT stafing- US IT Recruiter- US IT Technical Recruiter...,We are a New Jersey based staffing company. We are looking to hire self-motivated IT recruiters (US ...,250000 - 600000 P.A.,2018-03-15,3,8,250000,600000
https://www.naukri.com/job-listings-US-IT-Recruiter-walk-in-Acclive-InfoTech-Noida-Sector-3-Noida-United-States-U-S-1-to-5-years-150318009267?src=jobsearchDesk&sid=152172294625&xp=43&px=11,US IT Recruiter (walk-in),US IT Recruiter (walk-in),Acclive InfoTech,Noida(Sector-3 Noida)- United States (U.S),1-5 yrs,us it recruitment- dice- c2c- us staffing- bench sales...,  Walk-In interview     Saturday-  17th March  1- 6 PM  at ...,Not disclosed,2018-03-15,1,5,0,0
https://www.naukri.com/job-listings-US-IT-Recruiter-Exilant-Technologies-Pvt-Ltd-Bengaluru-3-to-5-years-150318008649?src=jobsearchDesk&sid=152172294625&xp=44&px=11,US IT Recruiter,US IT Recruiter,Exilant Technologies Pvt. Ltd.,Bengaluru,3-5 yrs,US IT Recruitment- us technical recruitment- us technical staffing, Job Location: Bangalore Role: US IT Recruiter   Work Time: 5.30PM - 3 AM ...,Not disclosed,2018-03-16,3,5,0,0
https://www.naukri.com/job-listings-We-are-Hiring-IT-Chennai-Serviont-Global-solutions-Limited-Chennai-3-to-5-years-150318003036?src=jobsearchDesk&sid=152172294625&xp=45&px=11,We are Hiring IT Recruiters Chennai,We are Hiring IT Recruiters Chennai,Serviont Global solutions Limited,Chennai,3-5 yrs,it recruitment- hiring- avaya- it recruiter- technical recruiter,Hi-  We are hiring recruiters in Chennai  Need resources with very good IT recruitment ...,Not disclosed,2018-03-15,3,5,0,0
https://www.naukri.com/job-listings-Senior-Executive-IT-Systems-DTDC-Express-Limited-Bengaluru-Victoria-Road-5-to-9-years-150318002401?src=jobsearchDesk&sid=152172294625&xp=46&px=11,Senior Executive IT - Systems,Senior Executive IT - Systems,DTDC Express Limited,Bengaluru(Victoria Road),5-9 yrs,Networking- Hardware- Troubleshooting- Linux- Technical Support...,Hello- Folks!  We have a requirement in our IT dept at DTDC Corporate Office  Job ...,100000 - 600000 P.A.,2018-03-15,5,9,100000,600000
https://www.naukri.com/job-listings-Senior-Executive-IT-Systems-DTDC-Express-Limited-Bengaluru-Victoria-Road-5-to-9-years-150318002373?src=jobsearchDesk&sid=152172294625&xp=47&px=11,Senior Executive IT - Systems,Senior Executive IT - Systems,DTDC Express Limited,Bengaluru(Victoria Road),5-9 yrs,Networking- Hardware- Troubleshooting- Linux- Technical Support...,Hello- Folks!  We have a requirement in our IT dept at DTDC Corporate Office  Job ...,100000 - 600000 P.A.,2018-03-15,5,9,100000,600000
https://www.naukri.com/job-listings-German-IT-MNC-Requires-Java-Programmers-Pass-Gerhard-Consulting-Alliance-Solutions-Centre-Private-Limited-Hyderabad-4-to-6-years-130118000860?src=jobsearchDesk&sid=152172294625&xp=48&px=11,German IT MNC Requires Java Programmers,German IT MNC Requires Java Programmers,Pass Gerhard Consulting Alliance Solutions Centre  Private Limited,Hyderabad,4-6 yrs,Software Development Life Cycle- Application Programming- Java EE...,We are looking for a Java Software Engineeers with experience in building high-performing- scalable- ...,400000 - 900000 P.A.,2018-03-19,4,6,400000,900000
https://www.naukri.com/job-listings-Sr-it-Recruiter-it-consulting-Immediate-Hiring-1-3-Year-noida-Reach-International-Corporate-Solutions-Noida-Sector-18-Noida-1-to-3-years-050218003695?src=jobsearchDesk&sid=152172294625&xp=49&px=11,Sr.it Recruiter|it |consulting| Immediate Hiring|1-3 Year,Sr.it Recruiter|it |consulting| Immediate Hiring|1-3 Year,Reach International Corporate Solutions,Noida(Sector-18 Noida),1-3 yrs,Recruitment- Hiring- IT Consulting- Social Media- Selection, ,50000 - 200000 P.A. negociable,2018-03-20,1,3,50000,200000
https://www.naukri.com/job-listings-Executive-Assistant-Male-Preferred-IT-Company-ahemdabad-Primrose-Ahmedabad-5-to-9-years-200318004430?src=jobsearchDesk&sid=152172294625&xp=50&px=11,Executive Assistant ( Male Preferred) - IT Company -ahemdabad.,Executive Assistant ( Male Preferred) - IT Company -ahemdabad.,Primrose,Ahmedabad,5-9 yrs,Communication Skills- Coordination- EA- PA- Executive Secretary..., ,Not disclosed,2018-03-20,5,9,0,0
https://www.naukri.com/job-listings-Sales-Executive-IT-Sales-Wisdmlabs-Mumbai-0-to-3-years-120617005606?src=jobsearchDesk&sid=15217229494280&xp=1&px=12,Sales Executive- IT Sales,Sales Executive- IT Sales,Wisdmlabs,Mumbai,0-3 yrs,it services- software sales- solution sales- sales executive- upsell...,WisdmLabs is looking for a Sales Executive hailing from IT Services and Solutions domain with relevant- ...,Not disclosed,2018-03-19,0,3,0,0
https://www.naukri.com/job-listings-Required-US-IT-night-Shift-FCS-Software-Solutions-Limited-Noida-Sector-57-Noida-0-to-2-years-080917006516?src=jobsearchDesk&sid=15217229494280&xp=2&px=12,Required US IT Recruiters (night Shift),Required US IT Recruiters (night Shift),FCS Software Solutions Limited,Noida(Sector-57 Noida),0-2 yrs,it recruitment- technical recruitment- us staffing- screening...,We are eagerly looking for Technical Recruiter for our Noida Office.  Need Freshers for IT ...,Not disclosed,2018-03-19,0,2,0,0
https://www.naukri.com/job-listings-US-IT-Recruiter-PruTech-Solutions-India-Pvt-Ltd-Hyderabad-2-to-5-years-090118009130?src=jobsearchDesk&sid=15217229494280&xp=3&px=12,US IT Recruiter,US IT Recruiter,PruTech Solutions India Pvt Ltd,Hyderabad,2-5 yrs,us it recruitment- w2- us staffing- dice- technical recruitment- screening-...,PruTech has an established Investment Banking Services division- which successfully supports and manages ...,Not disclosed,2018-03-16,2,5,0,0
https://www.naukri.com/job-listings-Servicenow-IT-Service-Management-Accenture-Bengaluru-4-to-8-years-190318900848?src=jobsearchDesk&sid=15217229494280&xp=4&px=12,Servicenow IT Service Management,Servicenow IT Service Management,Accenture,Bengaluru,4-8 yrs,Project management- Configuration management- Incident management- Tools..., ,Not disclosed,2018-03-19,4,8,0,0
https://www.naukri.com/job-listings-Hiring-for-Sr-Sales-Manager-Software-It-Sales-Wisdmlabs-Mumbai-3-to-5-years-081117007716?src=jobsearchDesk&sid=15217229494280&xp=5&px=12,Hiring for Sr. Sales Manager- Software/ It Sales,Hiring for Sr. Sales Manager- Software/ It Sales,Wisdmlabs,Mumbai,3-5 yrs,sales management- it services- it sales- sales- software sales...,WisdmLabs is looking for a Sr. Sales Manager hailing from IT Services and Solutions domain with relevant- ...,Not disclosed,2018-03-19,3,5,0,0
https://www.naukri.com/job-listings-Mgr-IT-India-BMC-Software-India-Pvt-Ltd-Pune-10-to-15-years-150318900900?src=jobsearchDesk&sid=15217229494280&xp=6&px=12,Mgr - IT - India,Mgr - IT - India,BMC Software India Pvt. Ltd,Pune,10-15 yrs,team management- customer management- customer satisfaction..., ,Not disclosed,2018-03-15,10,15,0,0
https://www.naukri.com/job-listings-Associate-IT-Support-Airmesh-Communications-Limited-Jammu-5-to-7-years-081117003428?src=jobsearchDesk&sid=15217229494280&xp=7&px=12,Associate IT Support,Associate IT Support,Airmesh Communications Limited,Jammu,5-7 yrs,Networking- Technical Support- Asset Management- Vendor Management...,This position requires demonstrable hands-on system hardware- software and O/S support experience ...,Not disclosed,2018-03-15,5,7,0,0
https://www.naukri.com/job-listings-Fcs-hiring-US-IT-Recruiter-it-Recruiter-urgent-Opening-FCS-Software-Solutions-Limited-Noida-Sector-57-Noida-0-to-1-years-310118005759?src=jobsearchDesk&sid=15217229494280&xp=8&px=12,Fcs@hiring US IT Recruiter/it Recruiter-urgent Opening,Fcs@hiring US IT Recruiter/it Recruiter-urgent Opening,FCS Software Solutions Limited,Noida(Sector-57 Noida),0-1 yrs,US IT Recruitment- US IT Staffing- Screening- Domestic Staffing- Sourcing..., Looking for US IT Recruiters on urgent basis preferred Domestic Technical Recruiters as well or who ...,175000 - 300000 P.A. Incentives+meal Reimbursement+...,2018-03-19,0,1,175000,300000
https://www.naukri.com/job-listings-German-IT-MNC-Requires-Senior-JAVA-Software-Engineer-PASS-GCA-Hyderabad-Germany-7-to-12-years-071117000321?src=jobsearchDesk&sid=15217229494280&xp=9&px=12,German IT MNC Requires Senior JAVA Software Engineer,German IT MNC Requires Senior JAVA Software Engineer,PASS GCA,Hyderabad- Germany,7-12 yrs,java- j2ee- core java- java developer jsf- jsf- spring- java ee- tomcat...,  Building high-performing- scalable- enterprise-grade Java applications.  Experience ...,700000 - 1600000 P.A.,2018-03-19,7,12,700000,1600000
https://www.naukri.com/job-listings-Mgr-IT-India-Confidential-Pune-8-to-10-years-301017900924?src=jobsearchDesk&sid=15217229494280&xp=10&px=12,Mgr - IT - India,Mgr - IT - India,Confidential,Pune,8-10 yrs,Customer service- Change management- audio- Monitoring- Access management...,Who we are and what we do   At BMC-  transformation is everything. It s how we bring IT to life for ...,Not disclosed,2018-03-15,8,10,0,0
https://www.naukri.com/job-listings-Huge-Openings-for-Freher-s-US-IT-Staffing-only-Males-CentillionZ-Hyderabad-Film-Nagar-0-to-2-years-070318007998?src=jobsearchDesk&sid=15217229494280&xp=11&px=12,Huge Openings for Freher's - US IT Staffing (only Males),Huge Openings for Freher's - US IT Staffing (only Males),CentillionZ,Hyderabad(Film Nagar),0-2 yrs,recruitment- us it staffing- hr- night shift- excellent communication...,Greetings from Centillionz IT Staffing Solutions  we are having Urgent Requirement for Freshers ...,175000 - 225000 P.A. Huge Incentives + Food Facility,2018-03-16,0,2,175000,225000
https://www.naukri.com/job-listings-Opportunity-for-US-It-non-ITl-compunnel-Compunnel-Technology-India-Private-Limited-Hyderabad-1-to-4-years-050318006761?src=jobsearchDesk&sid=15217229494280&xp=12&px=12,Opportunity for US It/non ITl Recruiters,Opportunity for US It/non ITl Recruiters,Compunnel Technology India Private Limited,Hyderabad,1-4 yrs,us it recruitment- c2c- w2- us staffing- technical recruitment- dice...,Hi Folks- Compunnel is hiring on the below mentioned positions:  Position :- IT ...,300000 - 650000 P.A.,2018-03-19,1,4,300000,650000
https://www.naukri.com/job-listings-Hiring-IT-Quality-Analyst-Fresher-Grazitti-Interactive-Chandigarh-0-to-1-years-290118000561?src=jobsearchDesk&sid=15217229494280&xp=13&px=12,Hiring IT Quality Analyst Fresher,Hiring IT Quality Analyst Fresher,Grazitti Interactive,Chandigarh,0-1 yrs,Test Cases- Automation Testing- Regression Testing- Performance Testing..., ,Not disclosed,2018-03-20,0,1,0,0
https://www.naukri.com/job-listings-Opening-Freshers-Technical-Sales-US-Voice-Process-bsl-IT-Com-Binary-Semantics-Limited-Gurgaon-0-to-1-years-150318005163?src=jobsearchDesk&sid=15217229494280&xp=14&px=12,Opening || Freshers|| Technical Sales (US Voice Process)bsl( IT Com.),Opening || Freshers|| Technical Sales (US Voice Process)bsl( IT Com.),Binary Semantics Limited,Gurgaon,0-1 yrs,International BPO- Technical Support- Inbound Sales- US Process...,   Job Responsibilities:    Responsible for providing telephone and remote ...,50000 - 300000 P.A. Daily and weekly Incentives,2018-03-15,0,1,50000,300000
https://www.naukri.com/job-listings-Opening-Freshers-Technical-Sales-US-Voice-Process-bsl-IT-Com-Binary-Semantics-Limited-Gurgaon-0-to-1-years-150318003314?src=jobsearchDesk&sid=15217229494280&xp=15&px=12,Opening || Freshers|| Technical Sales (US Voice Process)bsl( IT Com.),Opening || Freshers|| Technical Sales (US Voice Process)bsl( IT Com.),Binary Semantics Limited,Gurgaon,0-1 yrs,International BPO- Technical Support- Inbound Sales- US Process...,   Job Responsibilities:    Responsible for providing telephone and remote ...,50000 - 300000 P.A. Daily and weekl Incentives,2018-03-15,0,1,50000,300000
